email_sent_date,email_sent_time,sent_timestamp,post_url,post_title,post_body_text,post_date,post_time,post_timestamp,list_price,list_type,poster_gender,poster_age,treatment,reply,fave_reply,reply_date,reply_time,reply_timestamp,gender_in_email,age_in_email,email_sent_dow,post_dow,reply_dow
3/25/2019,1:29:00 AM,3/25/2019 22:29:00,https://indianapolis.craigslist.org/roo/d/indianapolis-private-room-for-rent/6850055985.html,Private room for rent,"Hello, I am leaving Indianapolis after April and am looking for somebody to fill the room that I am leaving. It is an adorable house within easy walking distance of grocery stores, several bus stops, and other amenities. Rent is $455/month plus utilities, which are roughly $100 total each month. Month-to-month lease options available. There are 4 other roommates living in the house, all private rooms. All of us are young professionals. You would only be sharing a bathroom with one other person. Washer and dryer in the house. Shared kitchen space. Everybody in this house tends to keep to themselves most of the time, but everybody is very sweet and will basically just let you do your thing. There are cats in the house. If you would like to see the place or if you would like more information, just email me and we can chat a bit more.",3/25/2019,1:13:00 PM,3/25/2019 13:13:00,455,house,NA,NA,katie_27,Y,Y,3/26/2019,8:50:00 AM,3/26/2019 8:50:00,,,2,2,3
3/25/2019,1:38:00 AM,3/25/2019 22:38:00,https://indianapolis.craigslist.org/roo/d/indianapolis-great-room-available/6836310361.html,GREAT Room Available Immediately,"All Utilities! Available April 1 (or the weekend before). Great near-southside location, just off 465. Minutes from U of Indy and super easy route downtown (14 minutes). Quiet home with professionals and serious adult students. FULL HOUSE privileges, fully furnished bedroom, wireless broadband and a great setup for those who want a quiet friendly place. Have a long history of great roommies who came from this website! Room can only accommodate 1 Person. Welcoming diversity of all backgrounds, nationalities. Happy to consider students and/or gainfully employed. Reliable transportation is a must since public transportation is quite limited. Just be pleasant, considerate and kind! Drop me a line if you have any questions. First and last month rent required.",3/8/2019,8:22:00 AM,3/8/2019 8:22:00,450,house,NA,NA,katie_27,Y,N,3/26/2019,6:10:00 PM,3/26/2019 18:10:00,presumed male,,2,6,3
3/25/2019,1:59:00 AM,3/25/2019 22:59:00,https://indianapolis.craigslist.org/roo/d/indianapolis-room-for-rent-160-week/6840889575.html,"Room for Rent $160 /Week - CABLE, Utilities, Internet ALL INCLUDED",ALL INCLUSIVE 10 minutes from downtown INDY GO 3 minutes walking distance REQUIRED 1 wk deposit + 1 wk of rent,3/13/2019,8:21:00 PM,3/13/2019 20:21:00,695,NA,NA,NA,katie_43,N,N,NA,NA,NA,,,2,4,NA
3/25/2019,2:01:00 AM,3/25/2019 23:01:00,https://indianapolis.craigslist.org/roo/d/indianapolis-room-for-rent-165-wk-cable/6838778488.html,"Room for rent $165/Wk - CABLE, Utilities, Intern","Private room for rent , $ 160/week in a newly remodeled home in North-East side All included in the price: utilities , high speed WIFI and internet, washer/dryer at home 10 minutes Castleton and Fishers 5 minutes to Starbucks and shopping center VERY PEACEFUL AND QUIET AREA ! REQUIRED : 1 wk deposit +1 wk of rent",3/11/2019,12:38:00 PM,3/11/2019 12:38:00,717,house,NA,NA,katie_43,N,N,NA,NA,NA,,,2,2,NA
3/25/2019,2:05:00 AM,3/25/2019 23:05:00,https://indianapolis.craigslist.org/roo/d/indianapolis-great-private-room-for/6846592577.html,GREAT PRIVATE ROOM FOR RENT AVAILABLE NOW,"Private furnished room/common areas (est. 1900 sq/ft) house shared w/ 1 other person. Located in Meridian-Kessler neighborhood. Two story duplex, 3 bedrooms, large living room, dining room, kitchen, full bath upstairs shared with 1 other, half bath downstairs. Fireplace. Downstairs washer and dryer. Beautiful neighborhood, near Butler U. and Broad Ripple, close to bus lines and Blue Indy. Large front porch and small back porch. Utilities included-electric, gas, water, sewer, WIFI, and Sling TV. On street parking. Can arrange to split the cost of household essentials i.e. t-p, paper towel, cleansers etc. If you are interested, please email me a description of yourself and please provide your phone number.",3/21/2019,4:56:00 AM,3/21/2019 4:56:00,430,house,NA,NA,katie_43,N,N,NA,NA,NA,,,2,5,NA
3/25/2019,1:40:00 AM,3/25/2019 22:40:00,https://indianapolis.craigslist.org/roo/d/indianapolis-female-bedroom-and-private/6849810855.html,female /bedroom and private bath,looking for roomate to share my home.... $700 month- 2 bedrooms and private bath.,3/25/2019,9:12:00 AM,3/25/2019 9:12:00,700,NA,NA,NA,katie_27,Y,Y,3/26/2019,7:04:00 AM,3/26/2019 7:04:00,presumed female,,2,2,3
3/25/2019,1:42:00 AM,3/25/2019 22:42:00,https://indianapolis.craigslist.org/roo/d/indianapolis-room-for-rent-155-week/6843131538.html,"Room for Rent $155/Week - CABLE, Utilities, Internet ALL INCLUDED","ALL INCLUDED IN THE PRICE : utilities, high speed WIFI , internet , washer/dryer at home 3 minutes from Children's Museum and 1 minute from highway 65 N VERY PEACEFUL AND QUIET NEIGHBORHOOD INDY GO across the street REQUIRED : 1 wk deposit + 1 wk of rent",3/16/2019,4:58:00 PM,3/16/2019 16:58:00,674,house,NA,NA,katie_27,N,N,NA,NA,NA,,,2,7,NA
3/26/2019,5:32:00 PM,3/26/2019 14:32:00,https://indianapolis.craigslist.org/roo/d/indianapolis-huge-2-spacious-room/6850912347.html,"Huge 2 spacious room available for rent in (N Delaware St, Indianapolis, IN)","2 spacious room in a 3 bed 3 bath apartment is available right now to move in. Room is pretty spacious for 2 person. It will work perfect for someone who works in Portland. I am 24 years old, my name is Grey. I live a healthy lifestyle, workout and eat good. I do not smoke, do drugs nor drink. I understand if you do, but smoking and drugs are not allowed in the apartment drinking is fine if you keep it to yourself. I have a full time job and I am gone all day. I am probably the most understanding and the chill person you will ever meet.I am looking for someone who can pay their rent on time. Utilities are included. *Appointment? Anytime message me here::(720) 507-5614",3/26/2019,1:29:00 PM,3/26/2019 13:29:00,400,apartment,NA,NA,katie_27,N,N,NA,NA,NA,,,3,3,NA
3/26/2019,5:38:00 PM,3/26/2019 14:38:00,https://indianapolis.craigslist.org/roo/d/indianapolis-safe-clean-room-available/6850877045.html,Safe Clean Room Available in Lawrence,"Share this lovely house with 4 other very clean, intelligent and polite people. All hard wood floors, established and safe neighborhood where Tasha and I have lived for years. Shared bath and kitchen - we get along well! Expectation is to pay rent on time and clean up 101%. Your room is private/locks/and quiet. Kitchen is well equipped, bath is always clean, open driveway, and full laundry. Let's meet. 317-515-7405 or jojojudd@yahoo.com.",3/26/2019,12:55:00 PM,3/26/2019 12:55:00,543,house,NA,NA,katie_27,Y,Y,3/26/2019,7:15:00 PM,3/26/2019 19:15:00,presumed female,,3,3,3
3/27/2019,10:07:00 PM,3/27/2019 19:07:00,https://indianapolis.craigslist.org/roo/d/carmel-room/6852070945.html,Room (Carmel),"I have a very clean room for rent around Carmel area the room is $600 including all utilities like electricity, internet, washer/dryer water etc...it close to meijer and 7 min away from Kroger and Walmart available from the 1st of April. Contact me for more details",3/27/2019,7:50:00 PM,3/27/2019 19:50:00,600,NA,NA,NA,katie_27,N,N,NA,NA,NA,,,4,4,NA
3/27/2019,11:48:00 PM,3/27/2019 20:48:00,https://indianapolis.craigslist.org/roo/d/indianapolis-search-roomate-25-college/6852058474.html,Search roomate 25 college Av,"Hi, I'm man 34 years,",3/27/2019,7:32:00 PM,3/27/2019 19:32:00,335,apartment,male,34,katie_43,Y,Y,3/28/2019,2:48:00 PM,3/28/2019 14:48:00,,,4,4,5
3/27/2019,11:49:00 PM,3/27/2019 20:49:00,https://indianapolis.craigslist.org/roo/d/indianapolis-room-for-rentupstairs/6830729738.html,Room for rent(upstairs) women only,"I have an upstairs for rent. You will have 2 rooms to yourself. Shared bathroom/kitchen. I am a 30yr old black male, renting to women only simply because I just don't like living with men. I am quiet and respectful. Perfect tenant would also be a quiet one with little to no company. If interested call or text",3/1/2019,12:10:00 AM,3/1/2019 0:10:00,300,house,male,30,katie_43,Y,Y,3/28/2019,3:18:00 AM,3/28/2019 3:18:00,,,4,6,5
3/27/2019,10:08:00 PM,3/27/2019 19:08:00,https://indianapolis.craigslist.org/roo/d/indianapolis-room-4-rent/6851960192.html,Room 4 Rent,"Furnished room for rent. We are renovating! cheaper rent until renovations are complete, then rent will go up. All utilities included. No deposit. No Background Checks Available now!",3/27/2019,5:23:00 PM,3/27/2019 17:23:00,350,house,NA,NA,katie_27,Y,Y,3/29/2019,11:11:00 AM,3/29/2019 11:11:00,,,4,4,6
3/27/2019,11:51:00 PM,3/27/2019 20:51:00,https://indianapolis.craigslist.org/roo/d/private-bedroom-bath-southeast/6851922791.html,Private bedroom/bath southeast - utilities included,Private bedroom/bath on southeast side for an additional female roommate. Split floorplan. Open room is master bedroom with bathroom. $640 utilities included. W/D in house. furnished room if needed. No pets or smoking.,3/27/2019,4:41:00 PM,3/27/2019 16:41:00,640,house,NA,NA,katie_43,N,N,NA,NA,NA,,,4,4,NA
3/27/2019,10:09:00 PM,3/27/2019 19:09:00,https://indianapolis.craigslist.org/roo/d/indianapolis-2360ft2-2-br-in-fountain/6851710959.html,2 BR in Fountain Square for rent. ,"I have two bedrooms for rent in a recently renovated house located in vibrant Fountain Square. I am the owner, a male young professional, and I live in the third bedroom. I am looking for one or two responsible and tidy roommates to fill the open rooms, available at the end of March. No preference on the gender of either roommate.",3/27/2019,1:03:00 PM,3/27/2019 13:03:00,520,house,male,NA,katie_27,Y,Y,3/27/2019,10:11:00 PM,3/27/2019 22:11:00,presumed female,,4,4,4
3/27/2019,11:52:00 PM,3/27/2019 20:52:00,https://indianapolis.craigslist.org/roo/d/indianapolis-avail-4-8-private-entrance/6851679845.html,Private Entrance 1 BR / 1 BA All Utilities / Wifi Included,"Cozy 1 bedroom apartment located in the heart of beautiful historic Woodruff Place and close to everything downtown Indianapolis has to offer. Offered to a single renter. Walkable to the Monon Trail and Pacers Bikeshare, as well as Rabble Coffee Shop, Mayfair Taproom, Beholder Restaurant, Centerpoint Brewery and the Chase Legacy Center gym. Ample free street parking and bike storage if needed. Your furnished accommodations include a comfy queen sized bed, private entrance with your own porch, a beautifully updated full bath, and a kitchenette with everything you might need.",3/27/2019,12:33:00 PM,3/27/2019 12:33:00,760,apartment,NA,NA,katie_43,Y,Y,3/29/2019,8:47:00 PM,3/29/2019 20:47:00,,,4,4,6
3/27/2019,11:53:00 PM,3/27/2019 20:53:00,https://indianapolis.craigslist.org/roo/d/indianapolis-spare-room-for-rent/6851605661.html,Spare room for rent,Decent sized room in southside Indianapolis Indiana. 5mins from downtown. No deposit. 420 Cool. Female roommate preferred. Viewing of the apartment anytime after 5:30,3/27/2019,11:22:00 AM,3/27/2019 11:22:00,360,apartment,NA,NA,katie_43,Y,Y,3/28/2019,4:56:00 AM,3/28/2019 4:56:00,,,4,4,5
3/28/2019,6:57:00 PM,3/28/2019 15:57:00,https://indianapolis.craigslist.org/roo/d/indianapolis-mastersuite-for-rent-in/6852727902.html,MasterSuite for rent in Owner share 4 bedroom home.,MasterSuite for rent in Owner share 4 bedroom home,3/28/2019,4:52:00 PM,3/28/2019 16:52:00,985,house,female,NA,katie_27,N,N,NA,NA,NA,,,5,5,NA
3/28/2019,7:07:00 PM,3/28/2019 16:07:00,https://indianapolis.craigslist.org/roo/d/indianapolis-little-flower-near/6852753420.html,Little Flower near Irvington,"Furnished bedroom in 2 Bedroom house for rent. Furniture can be moved out if need be. All utilities and wi-fi included. I work for an airline and my schedule takes me away for days at a time. Would be nice to find someone with similar crazy schedule. Washer/dryer included in unit. Male roommate preferred. If interested, please reply with more on your current work and living situation - and a way to contact you. Thanks!",3/28/2019,5:23:00 PM,3/28/2019 17:23:00,400,house,NA,NA,katie_43,N,N,NA,NA,NA,,,5,5,NA
3/28/2019,7:08:00 PM,3/28/2019 16:08:00,https://indianapolis.craigslist.org/roo/d/furnished-room-available-for-rent/6852562846.html,Furnished Room Available For Rent,"Furnished Room Available For Rent In Carmel, IN - Clay Terrace area. Nice size room with large closet furnished with full size bed, nightstand, desk, chair and 2 lamps. I am asking 480.00 per month for rent (includes, water, sewer and trash removal) and the electric 60.00 per month. Total for Rent and Utilities is 540.00 a month if you are a conscientious person and turn off lights, etc when not in the room, close doors and don't have the window open while air-conditioning or heat is running, etc. If not, then the 60.00 per month utility will be increased per month to compensate me for the additional electric bill amount as a result of your habits. Rent is due on the 1st of the month or you will have to pay a late fee of $35.00 per day. I'm not requiring a signed lease at this time just looking for someone who is professional and responsible. Each of us will need to agree to give the other a 30 day notice to vacate. I do require a security deposit. WHAT I AM EXPECTING IN A TENANT RENTING A ROOM FROM ME: I'm respectful of others space and property, quiet, don't have overnight guests, I don't party, I buy my own toiletries, paper towels, cleaning supplies, etc. The same is required of you! I do not supply any of your food, paper items, cleaning supplies toiletries, etc. . . . So, you will use your stuff and I will use mine. DEAL-BREAKERS FOR ME: • The room is only for one adult person, not person and animal, not a couple and not a parent and child • I am unable to rent to anyone who has domestic issues with a current or former significant other that could result in screaming matches, fights, etc. in my home.",3/28/2019,1:49:00 PM,3/28/2019 13:49:00,540,apartment,NA,NA,katie_43,Y,Y,3/28/2019,12:14:00 AM,3/29/2019 0:14:00,presumed female,,5,5,5
3/28/2019,6:58:00 PM,3/28/2019 15:58:00,https://indianapolis.craigslist.org/roo/d/carmel-carmel-3bedroom-bathroom-garage/6852466647.html,"Carmel, 3Bedroom & 2-1/2Bathroom & Garage","Carmel, newer 3 Bedroom & 2-1/2 Bathroom & Garage house, located in center of Carmel, female home owner looks for roommate to share. the roommate will have it's self one bedroom and bathroom as well. Female applys only.",3/28/2019,12:15:00 PM,3/28/2019 12:15:00,500,house,female,NA,katie_27,N,N,NA,NA,NA,,,5,5,NA
3/28/2019,6:59:00 PM,3/28/2019 15:59:00,https://indianapolis.craigslist.org/roo/d/indianapolis-downtown-iupui-campus/6852379390.html,"downtown-IUPUI campus furnished , utilities, WiFi incl $598","This location on iupui Medical school campus downtown Indy walking distance to Methodist hospital and fall Creek park. 5 min to IU Medical school at quite neighborhood We are looking for two roommate is to share this house with us . fullsize kitchen including all appliances and cooking Ware plus utensils with dishwasher has separate laundry room .living room has wall fire place (all utilities, WiFi and all furnished because new hardwood floor please wear slippers inside the house.so we can keep house clean.Please contact property manager David at show contact info . If you like check out our place It is very. Convenient location walking distance to all the restaurant like Starbucks Chipotle, pizza hut , panda express family Dollar, Lincoln pancakes house, city BBQ and crown liquid store. Even Subway sandwich , Hardee ,papa John in 5 minutes walking distance and we are on busline to downtown convention center We have Protection one security system and new concrete parking lot and with security light We have one private room with private bathroom is $598. Another private room share big bathroom is $585. All furnished House rules: no smoking /no party and no pet . Thanks :)",3/28/2019,10:47:00 AM,3/28/2019 10:47:00,598,house,NA,NA,katie_27,Y,Y,3/28/2019,7:05:00 PM,3/28/2019 19:05:00,presumed male,,5,5,5
3/28/2019,7:01:00 PM,3/28/2019 16:01:00,https://indianapolis.craigslist.org/roo/d/nice-room-for-rent-near-castleton/6852368123.html,Nice room for rent near Castleton,"Nice room for rent with bath in house near Castleton. Includes free wifi and w/d use. Clean, responsible, employed. $500 month + $200 deposit",3/28/2019,10:34:00 AM,3/28/2019 10:34:00,500,house,NA,NA,katie_27,N,N,NA,NA,NA,,,5,5,NA
3/28/2019,7:10:00 PM,3/28/2019 16:10:00,https://indianapolis.craigslist.org/roo/d/indianapolis-clean-and-comfortable/6843046857.html,Clean and Comfortable Bedroom Avail@ble,"Ramblewood Drive, Westchester Estates, Indianapolis, IN, United States Bed space available! No Lease and No Credit Check needed. Looking for a clean, professional, and hard working male adult seeking a nice & quiet space to rest. Nice convenient area! Located walking distance from: -Bus stations -Laundromat -Shop Rite and more!",3/16/2019,3:18:00 PM,3/16/2019 15:18:00,415,house,NA,NA,katie_43,Y,Y,3/31/2019,6:29:00 AM,3/31/2019 6:29:00,,,5,7,1
3/28/2019,7:10:00 PM,3/28/2019 16:10:00,https://indianapolis.craigslist.org/roo/d/plainfield-room-for-rent/6852285355.html,Room For Rent,"Hello! I am a 37 year old male with a daughter and I am renting out a bedroom to my house for one lucky person. I prefer a female as I think my daughter would be more comfortable. I am easy to live with and give privacy. I just ask that you help keep things tidy and drama free. This is not a relationship proposal or a friends with benefits deal. I am really looking forward to this and have patience as I am very picky! House comes with everything you see below. Room is not furnished. -Super Fast Wifi -Washer/Dryer -Appliances -All Utilities Paid -Very nice, crime free neighborhood -Full use Kitchen -And More!",3/28/2019,8:36:00 AM,3/28/2019 8:36:00,500,house,male,37,katie_43,Y,Y,3/28/2019,7:16:00 PM,3/28/2019 19:16:00,,,5,5,5
3/28/2019,7:11:00 PM,3/28/2019 16:11:00,https://indianapolis.craigslist.org/roo/d/columbus-furnished-room-for-rent/6852253760.html,Furnished Room For Rent,"I have a two bedroom home wish to rent out one of the rooms..I have cable,net and washer and dyer you will get full use of the house.I am a local middle age business man so pretty much work and chill...Can be long term or short term just looking for that right person so male or female roommate is fine I am also a smoker..Asking $75 a week for all",3/28/2019,6:43:00 AM,3/28/2019 6:43:00,326,house,male,middle-age,katie_43,Y,Y,3/29/2019,8:25:00 AM,3/29/2019 8:25:00,,,5,5,6
3/28/2019,7:12:00 PM,3/28/2019 16:12:00,https://indianapolis.craigslist.org/roo/d/indianapolis-rooms-for-rent-near/6852251270.html,(((Rooms For Rent Near Downtown $150 per week All Utitlites included!,I have 2 rooms in 19 and 21 Hendricks For Rent All utilities included wifi and laundry also shared kitchen and bathrooms $150 per week plus 75 dollar non refundable cleaning fee call,3/28/2019,6:26:00 AM,3/28/2019 6:26:00,652,house,NA,NA,katie_43,Y,Y,3/29/2019,8:50:00 AM,3/29/2019 8:50:00,,,5,5,6
3/28/2019,7:13:00 PM,3/28/2019 16:13:00,https://indianapolis.craigslist.org/roo/d/indianapolis-rent-private-rooms-155/6852214192.html,"Rent private rooms $155/Week-CABLE, Utilities, Internet ALL INCL","ALL INCLUDED IN THE PRICE : utilities, high speed WIFI , internet , washer/dryer at home 3 minutes from Children's Museum and 1 minute from highway 65 N VERY PEACEFUL AND QUIET NEIGHBORHOOD INDY GO across the street REQUIRED : 1 wk deposit + 1 wk of rent",3/28/2019,1:12:00 AM,3/28/2019 1:12:00,674,apartment,NA,NA,katie_43,N,N,NA,NA,NA,,,5,5,NA
3/28/2019,7:03:00 PM,3/28/2019 16:03:00,https://indianapolis.craigslist.org/roo/d/indianapolis-downtown-indy-lockerbie/6852201262.html,Downtown Indy Lockerbie room $400 furnished,This new remodeling 3 story house 2 1/2 bathroom in downtown Indy @ Lockerbie best area in Indianapolis downtown ) we has all updated kitchen with all appliances and washer and dryer too. front porch can enjoy fire work on July 4. Back patio had big deck and perfect for summer cook out and hang out Walking distance to Mass Ave and old ( Marsh. Supermarket just one block away. ) access to I-65 only one minute away. So it is very convenient location We has one room available with furnished. Only $400 + utilities. Will be available late March Appointment available and credit check required,3/28/2019,12:18:00 AM,3/28/2019 0:18:00,400,house,NA,NA,katie_27,Y,Y,3/29/2019,6:29:00 PM,3/29/2019 18:29:00,,,5,5,6
3/29/2019,10:31:00 PM,3/29/2019 19:31:00,https://indianapolis.craigslist.org/roo/d/indianapolis-looking-for-roommates/6853682073.html,"$400 Looking for roommates (Indianapolis)
","Looking for a honest roommate and some one anit on no games and 
truthfull. I'm renting it for 100 a week are 400 month got have the 
money up front please",3/29/2019,8:13:00 PM,3/29/2019 20:13:00,400,house,NA,NA,katie_43,Y,Y,3/29/2019,10:34:00 PM,3/29/2019 22:34:00,,,6,6,NA
3/29/2019,10:34:00 PM,3/29/2019 19:34:00,https://indianapolis.craigslist.org/roo/d/indianapolis-room-available-in-two/6853614612.html,$425 Room available in two bedroom apartment (8417 Chadwood Ln East Drive Apt 3c),"There is a room available for rent on the north side of Indianapolis on 
 Michigan and 86th street. The location is safe. There's a Walmart 
behind the 

apartment and other stores within five minutes drive include, Kroger, 
aldi, dollar general, Ross, Jcpenney and many other stores. There's a 
washer and dryer. The apartment has a pool and free gym for all 
residents. The roommate is a young lady between the ages of 25 and 30. 
She is a dedicated Christian and quiet. She works night so she won't be 
home most of the time.    ",3/29/2019,6:37:00 PM,3/29/2019 18:37:00,425,apartment,female,25-30,katie_27,N,N,NA,NA,NA,,,6,6,NA
3/29/2019,10:32:00 PM,3/29/2019 19:32:00,https://indianapolis.craigslist.org/roo/d/indianapolis-furnished-bedrooms-for/6853336193.html,$550 FURNISHED BEDROOMS FOR RENT **ALL UTILITIES INCLUDED**,"Two bedrooms available for rent. The master bedroom (*room with creme 
walls) is 11.5 by 11, has a nice size closet that includes four shelves,
 a ceiling fan and is $550/mo. The second bedroom (*room with green 
walls) is 11 by 11, has closet space, two floating shelves, a ceiling 
fan and is $500/mo. Both rooms come furnished with a twin bed, a dresser
 for clothing storage and a powered nightstand that includes 3.2 amp for
 phone charging. The rest of the house will be shared with other 
tenants. There’s a dining area with two chairs & a lounge area with 
two chairs and a TV. The kitchen has appliances; stove microwave, 
cooking ware, plates, glasses, eating utensils etc. Amenities of the 
house includes WiFi, washer & dryer, closed in back porch, fenced in
 front & back yard and long drive way accessible to main street and 
alley. No pets. Serious inquiries only. 

LIVING BETTER INVESTMENT ",3/29/2019,1:37:00 PM,3/29/2019 13:37:00,550,house,NA,NA,katie_43,N,N,NA,NA,NA,,,6,6,NA
3/29/2019,10:35:00 PM,3/29/2019 19:35:00,https://indianapolis.craigslist.org/roo/d/columbus-furnished-room-available-for/6853234173.html,$700 Furnished Room Available for Female Roommate,"A completely furnished room is available in a 
cozy condo in Columbus. Washer/dryer in unit. Walking distance from 
Target and other shopping centers and Cummins FSP/GOB. 

You would have 1 other roommate, a young female professional who travels
 often. Rent is $700 +utilities. Must be able to provide proof of 
employment, references, first and deposit. Available immediately. 





1 pet ok with restrictions and non refundable deposit.    

",3/29/2019,12:01:00 PM,3/29/2019 12:01:00,700,condo,NA,NA,katie_27,Y,Y,3/29/2019,11:00:00 PM,3/29/2019 23:00:00,Marion,,6,6,6
4/3/2019,3:56:00 PM,4/3/2019 12:56:00,https://indianapolis.craigslist.org/roo/d/indianapolis-cozy-furnished-bedroom/6854158103.html,"Cozy Furnished Bedroom (1114 Newgate Cir Indianapolis, IN)","Cozy furnished bedroom and private bath available NOW... all utilities, internet, cable, laundry, private fridge and Wi-Fi included. Use of the kitchen, living room and family room are offered. Deposit and first month's rent required, along with background check and three references. No drugs, no alcohol, no smoking, no pets and no visitors. Home includes large deck and sits on a sweet lake...",3/30/2019,2:08:00 PM,3/30/2019 14:08:00,500,house,NA,NA,katie_43,N,N,NA,NA,NA,,,4,7,NA
