email_sent_date,email_sent_time,sent_timestamp,post_url,post_title,post_body_text,post_date,post_time,post_timestamp,list_price,list_type,poster_gender,poster_age,treatment,reply,fave_reply,reply_date,reply_time,reply_timestamp,gender_in_email,age_in_email,email_sent_dow,post_dow,reply_dow
3/21/2019,11:44:00 PM,3/21/2019 20:44:00,https://indianapolis.craigslist.org/roo/d/indianapolis-share-house-near-airport/6847331771.html,$600 Share house near airport - month to month (West Washington street),"Share house, private basement bedroom and private bathroom. King size sleigh bed, all furnished. Linens, towels etc. Tv provided. All utilities included in price of monthly rent. Comcast cable, WiFi, central a/c. Washer and dryer. Own refrigerator. Wound share the kitchen. One person only, no pets. If interested please contact me. It’s available now.",3/21/2019,10:38:00 PM,3/21/2019 22:38:00,600,house,NA,NA,katie_43,Y,Y,3/22/2019,8:49:00 AM,3/22/2019 8:49:00,,,5,5,6
3/21/2019,11:47:00 PM,3/21/2019 20:47:00,https://indianapolis.craigslist.org/roo/d/greenwood-2-bedroom-1-bath-to-share/6847218336.html,$420 / 820ft2 - 2 bedroom 1 bath to share (Greenwood),"Semi retired female seeking responsible person to share. Laid back, just don't want someone who brings the party home.",3/21/2019,7:15:00 PM,3/21/2019 19:15:00,420,apartment,female,NA,katie_43,Y,Y,3/23/2019,4:53:00 PM,3/23/2019 16:53:00,,,5,5,7
3/21/2019,11:57:00 PM,3/21/2019 20:57:00,https://indianapolis.craigslist.org/roo/d/indianapolis-furnished-room-in-adorable/6847161772.html,"$425 Furnished Room in Adorable Bungalow, Everything Included! (N Bosart Ave Indianapolis, IN)","We have a furnished room in our super cute and stylish bungalow for rent short-term. Available April 5! 1, 2, or 3 month lease. Includes all utilities, internet. Washer and dryer in the house, and easy street parking. Giant fenced in yard with deck and garden! Very near Irvington restaurants and shops, and close to Mass Ave and I70. Perfect for students or folks who are new in town and trying on neighborhoods. We are a queer couple in our late 20s/mid 30s, and have 2 small dogs and two quiet cats. One of us works from home in a basement office. We are pretty quiet and tidy.",3/21/2019,6:00:00 PM,3/21/2019 18:00:00,425,house,NA,late 20s/mid 30s couple,katie_43,N,N,NA,NA,NA,,,5,5,NA
3/21/2019,12:00:00 AM,3/21/2019 21:00:00,https://indianapolis.craigslist.org/roo/d/indianapolis-room-mates/6847167359.html,$400 Room mates (Indianapolis),We are looking for honest people no drama people get along with good hearted can give the money up front 400 month are 100 a week,3/21/2019,6:07:00 PM,3/21/2019 18:07:00,400,NA,NA,NA,katie_43,N,N,NA,NA,NA,,,5,5,NA
3/21/2019,12:10:00 AM,3/21/2019 21:10:00,https://indianapolis.craigslist.org/roo/d/indianapolis-roommate-wanted-in-nice/6847102799.html,"$360 Roommate wanted in NICE house (Indianapolis, IN)","In Brooking..2 stall garage and more off street parking. It is a nice part of town on a well traveled street. so the street is well maintained during winter months. Full back yard, garden, patio, fire pit, large grill, garden shed. I will be using the master bath.. there is another full bath and 2 bedrooms on main floor. 1 room in the finished basement with 3/4 bath.",3/21/2019,4:51:00 PM,3/21/2019 16:51:00,360,house,NA,NA,katie_43,N,N,NA,NA,NA,,,5,5,NA
3/21/2019,12:52:00 AM,3/21/2019 21:52:00,https://indianapolis.craigslist.org/roo/d/hanover-looking-roomates/6847136751.html,"$500 Looking roomates (Indianapolis,in) ","Looking to rent a room ... LOCATION MADISON, INDIANA, About us we are a couple with one small child looking to open are house up and rent out a room with private bathroom and wifi wireless an storage space and open parking available if you have a vehicle looking for rent wise weekly about 150 biweekly250 monthly 500 that includes wifi your also responsible for a 50 a month utilitie payment different prices for different ways a payment cheaper payment more monthly is how we choose to set it up but can be negotiated depending on seriousness of needing a place give us a call we can talk we are open to talking about the situation my names Mark and have a blessed day and like I said depending on your income we can discuss payment for rent and deposit",3/21/2019,5:30:00 PM,3/21/2019 17:30:00,500,house,male,NA,katie_27,Y,Y,3/22/2019,11:51:00 AM,3/22/2019 11:51:00,presumed female,,5,5,6
3/21/2019,12:53:00 AM,3/21/2019 21:53:00,https://indianapolis.craigslist.org/roo/d/indianapolis-2-rooms-available/6847121929.html,$450 / 700ft2 - 2 rooms available (Indy east),Beautiful Victorian home with two large bedrooms available Ready to move in. Master suite is $450 Other large bedroom is $400,3/21/2019,5:12:00 PM,3/21/2019 17:12:00,450,house,NA,NA,katie_27,Y,Y,3/22/2019,12:51:00 PM,3/22/2019 12:51:00,,,5,5,6
3/21/2019,12:42:00 AM,3/21/2019 21:42:00,https://indianapolis.craigslist.org/roo/d/indianapolis-looking-for-roommate/6834655212.html,$500 Looking For A Roommate (Fishers Indiana),"Hi. I am a 49 year old female. I have a 2 bedroom apartment in downtown Fishers. My roommate was transferred to Florida and I am looking for someone to share the place with. Large bedroom with big walk-in closet, private sink and private bathroom entrance. Very nice neighborhood. Serious inquiries only please.",3/6/2019,6:45:00 AM,3/6/2019 6:45:00,500,apartment,female,49,katie_43,N,N,NA,NA,NA,,,5,4,NA
3/21/2019,12:56:00 AM,3/21/2019 21:56:00,https://indianapolis.craigslist.org/roo/d/indianapolis-broad-ripple-room-in-house/6834655583.html,$400 Broad Ripple Room in House (Indianapolis),"Room available as soon as needed ($400 rent, $500 deposit). Two guys living in the house currently. Both are professionals in their early 30s. Work hard and mostly chill during the week. We occasionally party on the weekends but usually involves friends hanging out, watching sports or walking down to the nearby Broad Ripple strip. Responsible, employed inquiries only. Please email me some information about yourself if you are interested along with a contact phone number and I will reach out to you",3/6/2019,6:47:00 AM,3/6/2019 6:47:00,400,house,male,early 30s,katie_27,N,N,NA,NA,NA,,,5,4,NA
3/21/2019,1:00:00 AM,3/21/2019 22:00:00,https://indianapolis.craigslist.org/roo/d/indianapolis-females-for-one-room-in/6839395208.html,"$600 Females for one room in a two-bedroom apartment for rent (9 on canal, Indianapolis)","Hi! I am looking for a female to rent a bedroom in a two-bedroom 9 on canal apartment, Indianapolis. The room comes furnished with a bed, side table and a study table-chair. The room has an attached closet and bathroom with 24 *7 access to hot water. The house has a living room with sofa, coffee table, and a TV. The apartment comes with inhouse laundry unit. The apartment has a nice cozy environment with amenities like coffee shop, swimming pool, 24*7 access to the gym and an open terrace area. It has an attached garage. The lease is currently till 09/22/2019. Please see the attached photos and link to the apartment. Interested person can move in from April. https://www.9oncanal.com/9-on-canal-apartments-indianapolis-in/",3/12/2019,7:02:00 AM,3/12/2019 7:02:00,600,apartment,NA,NA,katie_27,N,N,NA,NA,NA,,,5,3,NA
3/21/2019,12:43:00 PM,3/21/2019 9:43:00,https://indianapolis.craigslist.org/roo/d/indianapolis-looking-for-female-roommate/6837532105.html,$550 Looking for a female roommate (Indianapolis),"Housemate Needed- Looking for low key, drama free, and responsible person. Super nice room for rent ..huge deck ..nice room. Near bus stop and train station. New re frig, washer/dryer, tile system, and new paint. Rent is $499 base rent. All Bills Paid is $550 for the regular room. Full access to: kitchen, living room, dining room, front yard, and back yard. Please reply with your name, employment status, contact number.",3/9/2019,3:37:00 PM,3/9/2019 15:37:00,550,house,NA,NA,katie_43,N,N,NA,NA,NA,,,5,7,NA
3/21/2019,1:00:00 AM,3/21/2019 22:00:00,https://indianapolis.craigslist.org/roo/d/indianapolis-rooms-for-rent/6825811563.html,$150 Rooms For Rent (107 West 33rd Street),"WEST: 33rd & Illinois St (107 W. 33rd) Rooms available minutes from IVY Tech. Starting from $150/wk to $185/wk or $540/mo to $640/mo, which Includes all utilities, fully furnished bedroom with full/queen-size bed, has private suites with full or half bath, mini fridge, and microwave in all rooms, Wi-Fi, shared eat-in kitchen, washer & dryer.",2/22/2019,4:31:00 PM,2/22/2019 16:31:00,540,house,NA,NA,katie_27,N,N,NA,NA,NA,,,5,6,NA
3/21/2019,1:02:00 AM,3/21/2019 22:02:00,https://indianapolis.craigslist.org/roo/d/plainfield-looking-for-roommate/6846983229.html,$390 looking for roommate! (plainfield),"My current lease is up May 31st, and I'm looking for either a roommate to fill my current roommates spot or to move to another apartment complex within the Plainfield area. I'm a 21 yr old female with 2 dogs. My current apartment is a 2 bed 1 bath upstairs unit that's about 750 square feet. Please contact me for more info. :)",3/21/2019,2:44:00 PM,3/21/2019 14:44:00,390,apartment,female,21,katie_27,N,N,NA,NA,NA,,,5,5,NA
3/21/2019,1:03:00 AM,3/21/2019 22:03:00,https://indianapolis.craigslist.org/roo/d/indianapolis-private-room-with-private/6846888747.html,$400 Private Room with Private Bathroom (Indianapolis),Newly Renovated Furnished Room with private bathroom and shared kitchen for $400 a month!,3/21/2019,1:12:00 PM,3/21/2019 13:12:00,400,NA,NA,NA,katie_27,Y,Y,3/23/2019,9:32:00 AM,3/23/2019 9:32:00,,,5,5,7
3/21/2019,1:05:00 AM,3/21/2019 22:05:00,https://indianapolis.craigslist.org/roo/d/noblesville-clean-one-bedroom-available/6846871877.html,$550 Clean One bedroom available (46060),"One bedroom private bath 550.00 includes utilities. New construction 5 years old, nice place. Clean safe neighborhood. Families and kids. Nearby parks and trails",3/21/2019,12:57:00 PM,3/21/2019 12:57:00,550,NA,NA,NA,katie_27,Y,Y,3/23/2019,9:17:00 AM,3/23/2019 9:17:00,presumed male,,5,5,7
3/21/2019,1:06:00 AM,3/21/2019 22:06:00,https://indianapolis.craigslist.org/roo/d/indianapolis-sunny-spacious-private/6835648986.html,$400 Sunny spacious private bedroom in 3BR apartment (Westfield),"A sunny spacious private bedroom in 3BR apartment at Westfield is available between 17 March 18 (Sat) to 2 Apr 18. (Sun). We are located on Kirkland st, 10 min walk from Westfield Red line T stop. The bedroom is fully furnished and the rent is $400 (includes everything). You will be sharing bathroom and kitchen with two other roommates. We are clean, neat, responsible and we spend most of the time at school. Please note that the apartment does not have a living room. Coin operated laundry is in the basement. Street parking is available. No smoking, no party, no drugs please.",3/7/2019,11:16:00 AM,3/7/2019 11:16:00,400,apartment,NA,NA,katie_27,N,N,NA,NA,NA,,,5,5,NA
3/21/2019,12:44:00 AM,3/21/2019 21:44:00,https://indianapolis.craigslist.org/roo/d/indianapolis-96th-and-allisonville/6846803344.html,$525 / 1295ft2 - 96th and Allisonville - Available April 1st,"Seeking clean, respectful roommate on a month-to-month lease.

What comes with rent:
1 bedroom
1.5 shared bathrooms
1 twin bed
1 closet (additional space as needed)
Kitchen is usable and can use all utensils/cookware - must be kept cleaned
1 garage parking spot (no snow in the morning!)
All utilities included
Wifi included; working on a 5g package.

About me:
I'm not a neat freak, but I am clean. I like my place to stay clean whenever possible.
I have a potty-trained and well-mannered pomsky on site - he is not allowed in the tenant's room. He does not bark or howl.
If I have an issue, I voice my opinion and compromise on resolutions. I respect tenants who voice their opinions as well. I tend to get along with everyone, so this is simply a disclosure.

Expectations:
Noise should be kept to a moderate level. I do not mind guests, so long as the neighbors do not complain.
This is my home as well as yours - please keep it clean and classy!
Communicate.
No hard drugs. I do not mind if you smoke outside or in the garage, but absolutely nothing inside.

Please email with questions and to set up a showing. Typical response time is within minutes, but please give me 24 hours for when I am busy at work or on the road.",3/21/2019,11:52:00 AM,3/21/2019 11:52:00,525,house,NA,NA,katie_43,N,N,NA,NA,NA,,,5,5,NA
3/21/2019,1:07:00 AM,3/21/2019 22:07:00,https://indianapolis.craigslist.org/roo/d/greenwood-furnished-bedroom-with-its/6844204579.html,"$380 / 1800ft2 - furnished bedroom with its own full bathroom is available (310 Main St W, Greenwood, IN)","A furnished bedroom with its own full bathroom is available in a 2B2B apartment located in Greenwood, Indiana.The unit includes washer/dryer, dishwasher, oven, microwave, high speed internet, , air conditioner/heater, a beautiful lake view, etc.The apartment community offers free 24/7 access to gym, indoor basketball court, outdoor tennis court, pool and hot tub, paved jogging path, beautiful clubhouse, 24 Hour Maintenance Service Guarantee, Garages, Carports and Storage AvailableThis is only open to female, no children no big pets. prefer someone who's currently a student or working.Location in 310 Main St W, Greenw",3/18/2019,10:48:00 AM,3/18/2019 10:48:00,380,apartment,NA,NA,katie_27,N,N,NA,NA,NA,,,5,2,NA
3/21/2019,12:35:00 AM,3/21/2019 21:35:00,https://indianapolis.craigslist.org/roo/d/indianapolis-one-bedroom-is-available/6831003510.html,"$400 / 1700ft2 - One bedroom is available in a 2 bedroom, 2.5 bath house (499 E 14th St, Indianapolis, IN)","One bedroom is available in a 2 bedroom, 2.5 bath house in central Carmel. The house is located in a safe and quiet neighborhood, close to the freeways, Monon trail, the Performing Art Center, Library, dinning and shopping.Private bedrooms and shared bathroom with another three professional male housemates. The housemate can also use the first floor kitchen, laundry, living and dining room.Location in 499 E 14th St, Indianapolis, IN 46202, United States",3/1/2019,12:05:00 PM,3/1/2019 12:05:00,400,house,male,NA,katie_43,N,N,NA,NA,NA,,,5,6,NA
3/21/2019,12:45:00 AM,3/21/2019 21:45:00,https://indianapolis.craigslist.org/roo/d/room-for-rent-550-month-includes-all/6846708790.html,$550 Room for rent- $550/month INCLUDES ALL UTILITIES EXCEPT DISHWASHER,"Hi, I have a room for rent in my Fishers house. The house is located in a very good neighborhood off 131st and cumberland road, near Fishers High. Rent is 550/month including all utilities except dishwasher! Room is NOT furnished! Preferably someone who is clean and organized. For further details including pictures and dimensions, please contact me via email or phone/text. Thanks for looking.",3/21/2019,10:14:00 AM,3/21/2019 10:14:00,550,NA,NA,NA,katie_43,Y,Y,3/22/2019,8:32:00 AM,3/22/2019 8:32:00,,,5,5,6
3/22/2019,9:35:00 PM,3/22/2019 18:35:00,https://indianapolis.craigslist.org/roo/d/greenfield-want-female-roommate/6848011597.html,$350 / 700ft2 - Want a female roommate. (Greenfield),Looking for a female roommate. I am a retired male. Live in Greenfield.    ,3/22/2019,6:09:00 PM,3/22/2019 18:09:00,350,NA,male,NA,katie_43,Y,Y,3/22/2019,11:58:00 PM,3/22/2019 23:58:00,,,6,6,6
3/22/2019,10:24:00 PM,3/22/2019 19:24:00,https://indianapolis.craigslist.org/roo/d/zionsville-lux-on-capitol-sub-lease/6847910972.html,$515 ~Lux on Capitol Sub-Lease Available now~ (Indianapolis),"Hello! I am looking for someone to sub lease my apartment at Lux on 
Capitol for $515/month + Electric (about $25-$30) through July 30th. 
This is perfect for IUPUI students and anyone working in the downtown 
area, as it is just a 15 minute walk to campus and a 10 minute walk to 
Circle Center Mall.



This ad is for a private room and bathroom contained in an apartment 
with 3 other people. There is a shared kitchen and living room within 
the unit, including an in-unit washer and dryer.



Amenities include:



- A pool

- 24 hr fitness center

- Yoga studio

- Pool tables

- Ping Pong tables

- Gaming lounge

- Coffee bar

- Computer/Printing lab

- Basketball court

- Fire pit",3/22/2019,4:17:00 PM,3/22/2019 16:17:00,515,apartment,NA,NA,katie_27,Y,Y,3/22/2019,12:52:00 AM,3/23/2019 0:52:00,,,6,6,6
3/22/2019,10:32:00 PM,3/22/2019 19:32:00,https://indianapolis.craigslist.org/roo/d/indianapolis-all-utilities-just-your/6847977108.html,$575 / 1350ft2 - All utilities $575.00 just your Suitcase. (Fishers),"Deposit $575.00 (which is last month rent with 30 days notice ) 

Monthly rent $575.00.



Please call  show contact info
 phone and

Text. Landline  show contact info




First, subdivision is Backed up to ""Heritage Park"" and ""The Ambassador

House"" There are trails around

The Woods and River. Biking and

Hiking.



NO SMOKING.



I am a Quite Lady.



I spend most of the time in my room

on the iPhone/ iPad or just

Hanging with my Doggie.

Our paths probably won't pass one another, that Much.  

With

Cathedral Ceilings it is always most 

Quite.

I am very respectful of your time

And Place.



For rent, Ideally for a Professional 

Person.



Everything provided, 



Affluent, Crime Free, Crime Watch

Neighborhood. Extremely, Quiet,



Within two miles, Castleton Mall,

Highway 465. All major

Highways and Interstates. 

Many stores and

Very close to everything you may

Need.



Children do not live with me.



WiFi Internet. Direct T V and

Movie Channels. Nice porch

And Patio. Samsung Digital Television 

Provided in your Room, and

Living Room and Kitchen. Just

Bring your Suitcase!!!

Everything provided. Bed, chest of drawers, combo desk and bookshelf.



Home is Furnished and extremely 

Clean:



As private are

Your bedroom and bath room. Room

Is Furnished. Plus all Liens, sheets and kitchen ware etc.

 *No Smoking*.

 *Must pass Background check.    ",3/22/2019,5:28:00 PM,3/22/2019 17:28:00,575,house,female,NA,katie_27,Y,Y,3/23/2019,11:25:00 PM,3/23/2019 23:25:00,,,6,6,7
3/22/2019,9:43:00 PM,3/22/2019 18:43:00,https://indianapolis.craigslist.org/roo/d/zionsville-furnished-room-in-adorable/6847912313.html,"$550 Furnished Room in Adorable Bungalow, Everything Included! (Little Flower)","Hello!



We have a furnished room in our super cute and stylish bungalow for rent
 short-term. Available April 5! 1, 2, or 3 month lease. Includes all 
utilities, internet. Washer and dryer in the house, and easy street 
parking. Giant fenced in yard with deck and garden!



Very near Irvington restaurants and shops, and close to Mass Ave and 
I70. Perfect for students or folks who are new in town and trying on 
neighborhoods.



We are a queer couple in our late 20s/mid 30s, and have 2 small dogs and
 two quiet cats. One of us works from home in a basement office. We are 
pretty quiet and tidy.



Serious inquiries only, please. Thank you!    ",3/22/2019,4:19:00 PM,3/22/2019 16:19:00,550,house,NA,late 20s/mid 30s couple,katie_43,Y,Y,3/22/2019,12:53:00 AM,3/23/2019 0:53:00,,,6,6,6
3/22/2019,9:52:00 PM,3/22/2019 18:52:00,https://indianapolis.craigslist.org/roo/d/indianapolis-have-lovely-furnished-room/6833857602.html,$440 I have a lovely furnished room for rent in my home. (indianapolis),"I have a lovely furnished room for rent in my home. I'm renting a 
furnished room with a walk in closet and an independent restroom inside 
the room. Laundry, water and electricity is Have a. Kitchen , We may 
allow an small refrigerator and a microwave. Close to schools, shopping,
 beaches, Nature trails and parks.
",3/5/2019,8:15:00 AM,3/5/2019 8:15:00,440,house,NA,NA,katie_43,Y,Y,3/29/2019,4:37:00 PM,3/29/2019 16:37:00,,,6,3,6
3/22/2019,9:58:00 PM,3/22/2019 18:58:00,https://indianapolis.craigslist.org/roo/d/indianapolis-half-house-in-da-hood/6847718241.html,$400 half a house in 'da hood (arlington & 39th),"
Hello! I have a rental house in a not exactly ideal neighborhood in 
Indy, but its not too terrible.  No break ins or anything like that.  
I've accidentally left the doors unlocked dozens of times and it's been 
fine.  My boyfriend left me high and dry and I'm unable to pay all the 
rent and bills on my own.  I'm looking for a cool and friendly 
individual to split bills with.  You would have your own (small) room 
and a whole living room for your stuff.  Unfortunately there is only one
 bathroom so we would have to share that.  There is a big and secluded 
back yard which is a bonus.



I'm a 38 year old white female.  I have 2 kids who are with me Tuesdays 
and Thursdays for a few hours and Saturday for an overnight but we 
generally spend most of our time out of the house or hanging out with 
their dad who I am friendly with.  



I'm looking for someone cool and responsible enough to at least pay 
their share of the rent.  I am a pretty good roommate, clean and don't 
have wild parties or anything like that.  I would be ok with a male 
roommate as long as he is respectful and not gonna hit on me all the 
time or anything like that    ",3/22/2019,1:15:00 PM,3/22/2019 13:15:00,400,house,female,38,katie_43,Y,Y,3/23/2019,9:59:00 AM,3/23/2019 9:59:00,,,6,6,7
3/22/2019,9:59:00 AM,3/22/2019 6:59:00,https://indianapolis.craigslist.org/roo/d/indianapolis-large-furnished-room-in-2/6842067905.html,"$380 / 1800ft2 - Large Furnished Room in 2 Bedroom Apartment. (Carmel)
","This is a furnished room (Room 2) with a small bathroom in a four bedroom house. No used mattress or desk or dresser is allowed to move in. There are two kitchen rooms. You will share the kitchen with tenant in Room 3. The washer/dryer are in the basement. one roommate is a male visiting scholar in IU public health, and another roommate is a female professional with her daughter. The rent is $380 for a more than 6 month lease. $400 per month for a short-term lease. The rent includes utilities and wifi and furniture.No pets.",3/15/2019,12:15:00 PM,3/15/2019 12:15:00,380,house,NA,NA,katie_43,N,N,NA,NA,NA,,,6,6,NA
3/22/2019,10:37:00 AM,3/22/2019 7:37:00,https://indianapolis.craigslist.org/roo/d/indianapolis-room-for-rentluxury/6839393753.html,$1070 Room for rent!Luxury apartment (335 west 9th street),"Hi! I am looking for a female to rent a bedroom in a two-bedroom 9 on 
canal apartment, Indianapolis. The room comes furnished with a bed, side
 table and a study table-chair. The room has an attached closet and 
bathroom with 24 *7 access to hot water. The house has a living room 
with sofa, coffee table, and a TV. The apartment comes with an in-house 
laundry unit. The apartment has a nice cozy environment with amenities 
like coffee shop, swimming pool, 24*7 access to the gym and an open 
terrace area. It has an attached garage. The lease is currently till 
09/22/2019. The rent is $1070.5 which includes basin rent, utilities, 
and internet! Electricity bill is separate. Interested person can move 
in from May. If interested, please inbox me!    ",3/12/2019,6:54:00 AM,3/12/2019 6:54:00,1070,apartment,NA,NA,katie_27,N,N,NA,NA,NA,,,6,3,NA
3/22/2019,10:47:00 PM,3/22/2019 19:47:00,https://indianapolis.craigslist.org/roo/d/indianapolis-cheap-room-for-rent/6847397341.html,$300 Cheap room for rent (1412 n Pershing Ave),"I have a 2 bedroom apartment and was living with a roommate. I am the 
owner of the house. I have recently moved out of state. I am now looking
 to rent the room I was occupying. My roommate is still living there. He
 is a single African man, 55 years old, works 7 days a week, very 
peaceful and private person. 



The bills will be shared between the two occupants.



Interested individuals must have a current job, no violent criminal 
history, no drug users, no partying, must be a single occupant, maximum 
of 1 child.



I prefer email or texts as I am always busy and I will call back when I have time.    ",3/22/2019,2:56:00 AM,3/22/2019 2:56:00,300,apartment,male,55,katie_27,Y,Y,3/23/2019,4:06:00 PM,3/23/2019 16:06:00,,,6,6,7
3/22/2019,10:38:00 PM,3/22/2019 19:38:00,https://indianapolis.craigslist.org/roo/d/fishers-room-4-rent-male-preferred/6847624658.html,"$500 Room 4 Rent, male preferred (Fishers)","Looking for a male roommate. The rent is $500 month due on the first, 
with $50 deposit. The room is partly furnished with shared bathroom 
room.  I have another roommate, he is also gay. He works night as I work
 morning. Very quiet atmosphere. The home is located on a cal-da-sac. 
Pond behind the home. The bedroom is included with single bed,  
microwave and refrigerator. Also includes Netflix, cable and internet. 
You are responsible for all personal items, food, laundry items and  
toiletry items. Not looking for anyone into or on drugs.....not even  
marijuana. Nor a alcoholic. No pets....I have a cat.....Parking is on 
the str. All common area is living room, kitchen and laundry room. If 
you have any questions please ask. Text or email only, do not call..... 
Thank you    ",3/22/2019,11:52:00 AM,3/22/2019 11:52:00,500,house,male,NA,katie_27,Y,Y,3/22/2019,11:40:00 PM,3/22/2019 23:40:00,,,6,6,6
3/22/2019,10:06:00 PM,3/22/2019 19:06:00,https://indianapolis.craigslist.org/roo/d/indianapolis-roommate-for-2-bed-2-bath/6847518961.html,"$375 Roommate for 2 bed 2 bath! (indianapolis,IN)","Hi,

I am looking for a roommate to share an apartment. I am still looking 
for a place, but would be open to suggestions/willing to move into a 
current place. 



About me: 

24 year old female. Fairly outgoing and looking for a roommate I can be friends with! 



Are You Interested,know more about this Room, Please visit  WEBPAGE: ",3/22/2019,10:08:00 AM,3/22/2019 10:08:00,375,apartment,female,24,katie_43,N,N,NA,NA,NA,,,6,6,NA
