email_sent_date,email_sent_time,sent_timestamp,post_url,post_title,post_body_text,post_date,post_time,post_timestamp,list_price,list_type,poster_gender,poster_age,treatment,reply,fave_reply,reply_date,reply_time,reply_timestamp,gender_in_email,age_in_email,email_sent_dow,post_dow,reply_dow
4/3/2019,6:19:00 PM,4/3/2019 15:19:00,https://indianapolis.craigslist.org/roo/d/indianapolis-looking-for-cool-housemate/6857095618.html,Looking for cool housemate in Broad Ripple village (Broad Ripple),"Super hip, cool urban location near Monon Trail and creek/river

Friendly, super quiet, divorced, single queer guy, bookworm computer type, early 50s, very liberal progressive, vegetarian seeking housemate to rent one of 2 bedrooms. Shared full and half bath, laundry washer and dryer and storage possibilities in full unfinished basement. Nice kitchen with dishwasher, elec stove and oven range, countertop convection oven, microwave, double sink with disposal. Vintage full bath with claw foot tub with shower, and small half bath.
Dining room separates bedrooms for more privacy.
Fenced in small yard with privacy fence.
No driveway or garage but TONS of easy street parking right in front of the house.

Looking for housemate who is dog and cat friendly (I have 3 small dogs and a black cat), who is responsible, mature, liberal/progressive, quiet, lgbtq or lgbtq friendly, quiet. Income and personal landlord/roommate references required, and income equal to 2.5+ times monthly rent of $600 (plus half utilities).
Perfect for grad student etc.

Rent is $600 monthly due on the first of every month, plus half utilities (gas, water, elec and possibly cable tv/internet)
Move in costs are $600 first month plus $600 last month.
Bedroom is unfurnished with window and closet, some furniture can be provided by me if needed (desk, nightstand, brand new full size futon never used or slept on..)

420 friendly, cigarette smoking etc outdoors only. No loud music/noise, heavy drinkers or hard drugs or big parties etc.

Will add photos shortly!
If interested, shoot me an email thru reply to this ad,with a little about yourself and what you’re looking for etc.",4/3/2019,11:13:00 AM,4/3/2019 11:13:00,600,house,male,NA,katie_27,Y,Y,4/3/2019,7:22:00 PM,4/3/2019 19:22:00,,52,4,4,4
4/3/2019,6:19:00 PM,4/3/2019 15:19:00,https://indianapolis.craigslist.org/roo/d/indianapolis-1-nice-furnitured-room-in/6857082294.html,"1 nice furnitured room in a secure neighborhood available (3521 n Audubon rd, Indianapolis,IN)","1 bedrooms available in a 1.5 bathrooms single house of Audubon ready to move in. The front yard fully fenced, and rear fenced backyard offers lots of space for outdoor grilling, dining and entertaining. Brand new remodeled floor and painting inside .
We can share the washer & dryer, kitchen, bathrooms,living space and yards. Bedrooms are private, have locking doors and rented to only one person per bedroom.

$400 for rent and all utilities (heat/gas, electric, cable/internet). Also, $100 security deposit for the first month,we’ll return back to you if there’s no damage when you leave.

It's about 10 minutes to downtown Indy and close to arterial street 38th St. Public transportation via bus service is nearby. The library and CVS is around the corner.Free street and backyard parking.
Amenities:
Washer/dryer, refrigerator, electrical range and stove in house, Gas-forced central A/C, beautiful back yard is fenced around.
About myself:
I'm a nice ,hard-working woman, I treat people as I want treated.
I would prefer gentleman to move in. it's available right away.If you're interested in the room，I will be happy to show you the house. Call or text me at show contact info 。Please tell me some info about yourself--and I will contact you to set up a time to check out the place.
If you smoke anything, deal drugs, abuse drugs/substances, are violent, or bend or break rules/laws/leases, do not waste our time .

Candidates that can stay at least 6 months are preferred and would be considered for a reduced rate.

We don’t accept any person has history of eviction or other bad records !",4/3/2019,10:59:00 AM,4/3/2019 10:59:00,400,house,female,NA,katie_27,N,N,NA,NA,NA,,,4,4,NA
4/3/2019,4:06:00 PM,4/3/2019 13:06:00,https://indianapolis.craigslist.org/roo/d/indianapolis-350-month-room-to-rent/6857055292.html,$350 a month Room to rent,"Very close to downtown, IUPUI, and fountain square. 29yo female homeowner. Looking for a roommate to help with cost of living. $350 month and split utility bills. I have 3 cats. No dogs or children. Must be female. Clean non smoker. Large yard if you enjoy gardening. Garage and basement for plenty of storage. Washer and dryer and dishwasher.

Available Now 
Great home in a great location only 3 miles southwest of downtown and 3 miles west of Fountain square. 
Garage parking and storage. 


High speed internet. In home laundry. Furnished family room and furnished kitchen. 

Must be 21 or over.

Please keep the rooms clean. Especially clean the kitchen after cook. It's very important not to take stranger home without permission . Also, we can't make huge voice, or neighbor will call police. Please wear clean slippers inside . No dirty shoes on the carpet.No smoke inside.Lock your bedroom when you go out.Don't leave valuables in bedroom.Be nice and polite to anyone else in the house. No anything against law and moral is allowed.Please call me if you have any problems. I love every one that share my houses. 
",4/3/2019,10:31:00 AM,4/3/2019 10:31:00,350,apartment,female,29,katie_43,Y,Y,4/3/2019,4:28:00 PM,4/3/2019 16:28:00,,,4,4,4
4/3/2019,6:20:00 PM,4/3/2019 15:20:00,https://indianapolis.craigslist.org/roo/d/indianapolis-room-with-young/6844260354.html,Room with Young Professionals near Downtown Indy,"Large, well kept house with young professionals has 1 bedroom available for rent starting in February 2019. Two story house with a fully finished basement.

The house is located on the north side of downtown, 5 min drive to downtown and 10 min drive to Broad Ripple. Located near a nice public park and in a nice neighborhood area.

There are four bedrooms on the upper floor with two of the bedrooms occupied. There is also a fully finished basement with a bedroom/bathroom/living room etc. This is also occupied. Three young professionals (two guys and one girl) currently live in the house. The room available for rent is upstairs and will share a bathroom with one other person. It's a good size bedroom with a walk-in closet. The house is clean, well kept, and with high-end finishes. Looking for someone who will help keep it that way. Full kitchen, washer and dryer, living room and dining rooms and other shared areas come fully furnished. 

Rent is $500/mo plus a share of the utilities. Parking is off street on the driveway at the back of the house. No pets at this time. Current residents are young professionals and we're looking for someone who would be a good fit. If interested, let me know your situation and when you're needing to make a move. 
",3/18/2019,11:41:00 AM,3/18/2019 11:41:00,500,house,female/male,NA,katie_27,Y,Y,4/4/2019,1:10:00 PM,4/4/2019 13:10:00,,,4,2,5
4/3/2019,4:20:00 PM,4/3/2019 13:20:00,https://indianapolis.craigslist.org/roo/d/good-roommate-on-lake-needed/6856797280.html,Good roommate on a lake needed!!!!! (Just west of Danville),"Hello people....Long shot! too much to type. But, I am going through a divorce. Desperately trying to save my family home built in 1970 by my grandmother. It was added on to and remodeled(you know why). The basement is unfinished, but going to asap. If it helps I'd give you the garage also. Its 2car but tight.... Now I don't think I can afford it. It is about 3800sq/ft on a beautiful lake! The court it's on is full of lifelong friends and families! All very very close!! Have a dock, boat, the works. It's just a beautiful place...It will be devastating to myself and family. I am 47yo male fit healthy professional fireman in indy. I have two incredible children that obviously will be there often. You absolutely know the environment I'm looking for and needing. You know the quality of a roommate I absolutely must have with children!!!! You would literally have your own floor. It has a bedroom, big tv/living room, own bathroom with stand up shower, even a loft area for an office. Obviously shared kitchen and laundry room. Plus, a wonderful lake in your back yard!!! It's an incredible place. Basically I need a perfect roommate...Wonderful secure job, professional, respectful, clean, mature, person with a higher end income(preferably)!!! I would prefer that the person be an outdoor type, fitness type, fun!!! Not necessary, but would just be awesome to have same hobbies and activities. I would prefer a female roommate too...No, I'm not a perv :) I am in a wonderful relationship!!! Just prefer, little more professional, little more clean lol!!! But will take any perfect roommate...The bad part...I am looking for $1000/mo or best offer. I really couldn't go below $800, but I'm pretty desperate! We could at least talk and wheel and deal....You'd be paying for a wonderful house, a lake, boat, skiing, an absolutely fun summer(s).... 
Well, that's my desperate plea for the perfect roommate....Thanks for looking!!!! Here's a pic of my backyard. I'll get some more!!!!
Wish me luck!!!!!!!",4/2/2019,9:01:00 PM,4/2/2019 21:01:00,1000,house,male,47,katie_43,Y,Y,4/3/2019,6:07:00 PM,4/3/2019 18:07:00,,,4,3,4
4/3/2019,6:20:00 PM,4/3/2019 15:20:00,https://indianapolis.craigslist.org/roo/d/indianapolis-nice-room-for-rent-ivy/6856770550.html,"Nice Room for Rent: Ivy Hills - Sprawling Ranch, Big Front Yard, Fence","I have a nice room available for rent. I live in Ivy Hills off 79th and Allisonville. It’s a very nice area, giant front yard with mature trees, close to the interstate, fenced in back yard with screened in porch. You’ll have your own private bathroom, shower and open access to my washers and dryers. 2 car garage, house is very modern and kept very clean. I’m 4/20 friendly but must use garage or screened in porch.
I’m a straight, 32 year old white male who works in downtown Carmel 50 hours a week. I have no preference with regards to age, race or sexual beliefs but I’m looking for the right situation and don’t need the income so I’m willing to wait.
Feel free to reach out with any questions!",4/2/2019,8:19:00 PM,4/2/2019 20:19:00,550,house,male,32,katie_27,Y,Y,4/3/2019,7:11:00 PM,4/3/2019 19:11:00,,,4,3,4
4/3/2019,4:27:00 PM,4/3/2019 13:27:00,https://indianapolis.craigslist.org/roo/d/indianapolis-2360ft2-2-br-in-fountain/6854014769.html,2 BR in Fountain Square for rent.,"I have two bedrooms for rent in a recently renovated house located in vibrant Fountain Square. I am the owner, a male young professional, and I live in the third bedroom. I am looking for one or two responsible and tidy roommates to fill the open rooms, available at the end of May. No preference on the gender of either roommate.

The house is located a short walk to the heart of Fountain Square and Fletcher Place and a five minute drive to downtown or I-65. 2,360 square feet in total with 3 bedrooms and 2 bathrooms. The open bedrooms are each 130 square feet - 13x10 - and each have a closet. Features include an open floor plan, granite counter tops, all new stainless steel appliances, exposed cedar beams, cathedral/tray ceilings, two-story living room, a spiral staircase, fenced in front and back yards, a large back deck and front porch, contemporary lighting fixtures, and a two car garage.

The open bedrooms are not furnished as seen in the photos, but living spaces are.

Plenty of street parking available
1 garage spot available for an additional $15/month.
Utilities will be shared - gas, electric, recycling, Youtube TV, Verizon 5G Internet
Bedrooms include a closet not shown in the photos
Washer and dryer on the first floor
Dishwasher
Double Oven
Water softener installed
5 minute drive to Lilly, Salesforce, and others

Available end of May, but arrangements can be made for sooner in certain cases.

If you are interested, please contact me to set up a meeting and visit!",3/30/2019,11:43:00 AM,3/30/2019 11:43:00,500,house,male,NA,katie_43,Y,Y,4/3/2019,4:35:00 PM,4/3/2019 16:35:00,,,4,7,4
4/3/2019,4:34:00 PM,4/3/2019 13:34:00,https://indianapolis.craigslist.org/roo/d/indianapolis-roommate-opening/6854341353.html,Roommate Opening,"Seeking roommate in a furnished house. Now available. 
Message with your name and contact information if you are interested. 
*Non smokers only. 
Students and working professionals.
I will delete this ad when this room is rented.

Private bedroom area on first floor. You furnish your room. 
Large closet. 
Common areas are furnished and shared. 
Secure Nora suburb. Close to parks, gyms, and shopping . Flexible lease. 
In a great area. 
Quiet hours observed as a courtesy to roommates schedules. 
Laid back atmosphere. Privacy. 
Off street parking. Large yard. Private deck. Attached 2 car garage.
$700 a month. 
Utilities, lawn care and internet are included. 

No pets please. 
No alcohol or drug abusers.
Background check.",3/30/2019,5:39:00 PM,3/30/2019 17:39:00,700,house,NA,NA,katie_43,N,N,NA,NA,NA,,,4,7,NA
4/3/2019,5:19:00 PM,4/3/2019 14:19:00,https://indianapolis.craigslist.org/roo/d/indianapolis-female-roomate/6856434057.html,FEMALE ROOMATE-Masterbedroom w/ own bath (Glendale/Broadripple) ,"I am looking for a clean female roommate with job/life stability to share expenses at my 3 BR, 2 
BA home with full basement in a great location near parks & shopping in the Broad ripple area. 
You would have complete and sole access to the entire 2nd floor of this home (almost 600 sq. 
ft.)--which consists of a huge private 2nd floor Master bedroom, sitting area and 1/2 bath. The 
home has hardwood floors, full bath on the main floor, and living room with fireplace, wrap 
around front porch, off-street parking and access to Wi-Fi. The rent includes full access and use 
of all appliances, including washer & dryer and storage in the basement. I have a cat. Rent includes utilities. If you do have a cat or dog it would be additional $15 a month. Available in April, May or by June 1.
*We would need to meet first off-site to see if it would be a good match, before you can see the 
space and please only set up the appt. if you are going to show up. PLEASE text and cancel if it
doesn't work for you. 
$125 deposit",4/2/2019,1:53:00 PM,4/2/2019 13:53:00,485,house,NA,NA,katie_43,Y,Y,4/3/2019,9:13:00 PM,4/3/2019 21:13:00,presumed female,,4,3,4
4/3/2019,5:20:00 PM,4/3/2019 14:20:00,https://indianapolis.craigslist.org/roo/d/indianapolis-room-for-rent-in-speedway/6856388502.html,Room for rent in speedway,"Room for rent in Speedway Indiana .. 500 a month all bills included . Immediate move in . Smoking is not allowed !!!! SHORT TERM 2 months only . Rent is due 1st of the month . show contact info
. Bathroom is shared . Updated appliances . Beautiful townhouse in quiet area",4/2/2019,1:10:00 PM,4/2/2019 13:10:00,500,apartment,NA,NA,katie_43,Y,Y,4/3/2019,5:26:00 PM,4/3/2019 17:26:00,,,4,3,4
4/3/2019,5:20:00 PM,4/3/2019 14:20:00,https://indianapolis.craigslist.org/roo/d/indianapolis-room-available-downtown/6856159155.html,Room Available Downtown,"Newly painted, furnished bedroom in Lockerbie Townhome located one block from Mass Ave. and a quick walk to downtown. Parking, laundry, and rare downtown private patio are just a few of the benefits of this Townhome. Rent is $950, which includes utilities (water, electric, gas, and internet). Bathroom shared with one other tenant.

Townhome is currently occupied by two professional males in their mid to late 20's. Interested applicants will need to go through an interview process with current tenants. Flexible leasing options with preference for long term. Room is move-in ready. Pictures of room available upon request. Contact us today to set up a tour and interview",4/2/2019,9:04:00 AM,4/2/2019 9:04:00,950,apartment,male,NA,katie_43,N,N,NA,NA,NA,,,4,3,NA
4/3/2019,6:24:00 PM,4/3/2019 15:24:00,https://indianapolis.craigslist.org/roo/d/indianapolis-looking-for-responsible/6856115808.html,LOOKING for a RESPONSIBLE roommate to share house,"I am looking for a roommate/housemate to take the other room in my landlord's 2 bedroom 1.5 bath house. The current roommate is making a life change, and thus moving out. The house is one half of a nicely updated double in the popular Emerson Heights neighborhood right next to Irvington.

It features an updated kitchen with stainless appliances, finished hardwoods, unfinished basement, washer and dryer, and a fenced yard with fire pit.

The neighborhood is quiet and we're surrounded by long-time home owners.

To IUPUI's campus it's a 15 minute drive, 18 to 30 minute bike ride (depending on how fast you pedal [race bike vs cruiser]). It's on Michigan St, which has a bike path directly from the house to downtown and campus. There's also a Metro transit stop (Michigan and Bancroft) for the number 3 bus. 

It's also a 2 min walk to Ellenberger Park, 5 min bike ride to Irvington, with several new restaurants, Starbucks, Irvington Public Library, etc. 10 min bike ride to the Monon trail and 5 min drive to I-70.

Move in date anytime. Total cost would be $450 per month, and this includes rent, all utilities, and fast wireless internet",4/2/2019,7:12:00 AM,4/2/2019 7:12:00,450,apartment,NA,NA,katie_27,N,N,NA,NA,NA,,,4,3,NA
4/3/2019,5:26:00 PM,4/3/2019 14:26:00,https://indianapolis.craigslist.org/roo/d/indianapolis-huge-amazing-house/6855820550.html,Huge amazing house,"Hey all, I have an amazingly huge 7 bedroom 3.5 bathroom house. It has 2 fully furnished living rooms a huge nicely equipped kitchen. A garage game room. The backyard is fenced in with a fire pit and chairs to hang out on that warm summers night with your friends. I love this house and I need a good roommate who cares about my house as much as I do. I would love it if you could commit to one year but I'm flexible for the right person or couple. My house is currently being painted so we are in a bit of a transition period. I just had new siding and a new roof and gutters installed. If you do drugs, are highly volitale and in an unmedicated state have more felonies than I have fingers or just a plain old jerk to live with or be around then skip right on ahead to the next ad. I have a small room for rent for 500 per month or a larger room available for a bit more. All utilities are included in the monthly rental rate. I do have a few pieces of furniture that I could use to furnish your room if need be",4/1/2019,5:48:00 PM,4/1/2019 17:48:00,500,house,NA,NA,katie_43,N,N,NA,NA,NA,,,4,2,NA
4/3/2019,6:24:00 PM,4/3/2019 15:24:00,https://indianapolis.craigslist.org/roo/d/carmel-brand-new-house-two-rooms-to-rent/6855714199.html,Brand new house two rooms to rent,"Brand new kitchen-refrigerator, stove, dishwasher, washer/dryer, bathroom... never used! Wait for you to use.

I'm a well educated, professional. Not cooking and live in house yet. You and other house mate will enjoy this 4 bedroom beautiful house.

Clean and financially stable. female is preferred. No pets, no party, no drug!

Rent is $680, which includes high speed internet and trash. The utilities - gas, electricity and water/sewer will be shared. A background check will be ran. Only serious applicants need apply",4/1/2019,3:53:00 PM,4/1/2019 15:53:00,680,house,NA,NA,katie_27,Y,Y,4/3/2019,6:32:00 PM,4/3/2019 18:32:00,presumed male,,4,2,4
4/3/2019,6:25:00 PM,4/3/2019 15:25:00,https://indianapolis.craigslist.org/roo/d/indianapolis-roommate-needed-share/6855477625.html,roommate needed share sublet,"roommate needed in a New (2018) house in a safe and homey environment. Community Amenities: 1) Community pool 2) Walking and bike trail 3) Playground. House Amenities: 1) Living space and room furnished with new furniture 2) XFINITY Digital Starter 140+ Channels 3) XFINITY Blast!® 3) XFINITY® Home Secure 24/7 Security with Professional Monitoring 5) Free Washer and Dryer Utilities (Gas, Electric, Water, Sanitation) and cable included in rent",4/1/2019,12:06:00 PM,4/1/2019 12:06:00,450,apartment,NA,NA,katie_27,Y,Y,4/5/2019,5:23:00 AM,4/5/2019 5:23:00,,,4,2,6
4/3/2019,5:27:00 PM,4/3/2019 14:27:00,https://indianapolis.craigslist.org/roo/d/indianapolis-newly-available-furnished/6855441774.html,Newly available Furnished sleeping room for rent,Nicely furnished private sleeping room for rent $120 week or $480 month $125 deposit... all utilities included washer and dryer are available for use and you share the common areas..on the busline 7 minutes north of downtown,4/1/2019,11:32:00 AM,4/1/2019 11:32:00,480,house,NA,NA,katie_43,N,N,NA,NA,NA,,,4,2,NA
4/3/2019,6:26:00 PM,4/3/2019 15:26:00,https://indianapolis.craigslist.org/roo/d/indianapolis-downtown-iupui-campu/6855435540.html,"downtown-IUPUI campu ,furnished with all including WiFi incl $595","Hi it is April ,
have you plan move to downtown close to IUPUI campus area ?This location on iupui Medical school campus downtown 
Indy walking distance to Methodist hospital and fall Creek park. 5 min to IU Medical school at quite neighborhood 
We are looking for two roommate is to share this house with us . fullsize kitchen including all appliances and cooking Ware plus utensils with dishwasher has separate laundry room .living room has wall fire place (all utilities, WiFi and all furnished because new hardwood floor please wear slippers inside the house.so we can keep house clean.Please contact property manager David at show contact info . If you like check out our place
It is very. Convenient location walking distance to all the restaurant like Starbucks Chipotle, pizza hut , panda express family Dollar, Lincoln pancakes house, city BBQ and crown liquid store. Even Subway sandwich , Hardee ,papa John in 5 minutes walking distance and we are on busline to downtown convention center
We have Protection one security system and new concrete parking lot and with security light
We have one private room with private bathroom is $595. Another private room share big bathroom is $575. All furnished
House rules: no smoking /no party and no pet . Thanks ",4/1/2019,11:26:00 AM,4/1/2019 11:26:00,595,house,NA,NA,katie_27,Y,Y,4/3/2019,6:32:00 PM,4/3/2019 18:32:00,presumed male,,4,2,4
4/3/2019,5:27:00 PM,4/3/2019 14:27:00,https://indianapolis.craigslist.org/roo/d/indianapolis-great-location-furnished/6855219555.html,"Great location, Furnished, Roomate Needed","Easy access close to public transportation, 15 area restaurants within walking distance, blocks from the Monon Trail, Broad Ripple Village. Minutes from State Fairgrounds. 15 min from Downtown. 
My place provides good vibes & good energy only here. Furnished room with Queen Size bed. 
Great for single, responsible, LGBT friendly person. *Washer & Dryer on the property. *Most all utilities are included. Wi-Fi included.
Garden on the property, great area. Great Front Proch to relax on. 
Some shared common areas. *House-keeper comes twice a month to clean common areas. 
I see my clients throughout the week some days and evenings. Ideal for someone who enjoys a mostly quiet space. 
Some occasional get-togethers with friends. A friendly person here, I’m a 3/4 time Graduate Student and I work part-time from home. Gay Male. I practice meditation, yoga.
Some everyday shared household chores are required. 
Will interview and must 3 have references. Security deposit required and 1st months rent. 
Willing to host a 3-month lease with option to sign on for a year. 
Look forward to interviewing potential candidates",4/1/2019,12:48:00 AM,4/1/2019 0:48:00,540,apartment,male,NA,katie_43,Y,Y,4/3/2019,9:51:00 PM,4/3/2019 21:51:00,,,4,2,4
4/3/2019,6:26:00 PM,4/3/2019 15:26:00,https://indianapolis.craigslist.org/roo/d/zionsville-looking-for-young/6854624498.html,https://indianapolis.craigslist.org/roo/d/zionsville-looking-for-young/6854624498.html,"Looking for other young professionals to share an incredible mansion in Zionsville. Great for hosting events or simply having plenty of space.

Rent will be $500 for a single bedroom or $1250 to rent the entire basement.

I am a 27 year old working in healthcare and my girlfriend is a 27 year old software PM",3/31/2019,9:22:00 AM,3/31/2019 9:22:00,500,house,male,27,katie_27,Y,Y,4/3/2019,6:51:00 PM,4/3/2019 18:51:00,,,4,1,4
4/3/2019,6:27:00 PM,4/3/2019 15:27:00,https://indianapolis.craigslist.org/roo/d/indianapolis-indy-downtown-lockerbie-3/6854297794.html,Indy downtown- Lockerbie 3 bdroom house room to share $400,"Downtown indnapolis. ( Lockerbie ) 3 story new remodeling house 3 bd room 1/2 bath. Upscale house looking for one roommate
House has fireplace hardwood floors. New paint and one big bedroom. Abd all applicance plus washer and dryer
Walking distance to Mass Ave abd old Marsh supermarket. Only 7 minutes go to I-65 only one minutes
House has one old dog very friendly.. rent $400 share utilities included WiFi 
Will be available Marsh 31 2019",3/30/2019,4:43:00 PM,3/30/2019 16:43:00,400,house,NA,NA,katie_27,N,N,NA,NA,NA,,,4,7,NA
4/3/2019,5:28:00 PM,4/3/2019 14:28:00,https://indianapolis.craigslist.org/roo/d/indianapolis-looking-for-roommate/6854169840.html,Looking for a roommate,I have a large bedroom for rent 350 a month internet included prefer female roommate single mother with 1 child is ok for I am.a.single.mother myself hablo españal a single Male who is responsible and respectful with good job is ok no smoking drinking party etc,3/30/2019,2:20:00 PM,3/30/2019 14:20:00,350,apartment,female,NA,katie_43,Y,Y,4/3/2019,9:51:00 PM,4/3/2019 21:51:00,,,4,7,4
