email_sent_date,email_sent_time,sent_timestamp,post_url,post_title,post_body_text,post_date,post_time,post_timestamp,list_price,list_type,poster_gender,poster_age,treatment,reply,fave_reply,reply_date,reply_time,reply_timestamp,gender_in_email,age_in_email,email_sent_dow,post_dow,reply_dow
3/22/2019,10:08:00 PM,3/22/2019 19:08:00,https://indianapolis.craigslist.org/roo/d/greenwood-room-available/6847548820.html,$400 / 1250ft2 - Room available (Greenwood),Looking for a female to share my home with me. I have a small 3 bedroom house and 2 dogs. My boyfriend doesn't live with me but visits often.,3/22/2019,10:40:00 AM,3/22/2019 10:40:00,400,house,female,NA,katie_43,N,N,NA,NA,NA,,,6,6,NA
3/22/2019,10:45:00 PM,3/22/2019 19:45:00,https://indianapolis.craigslist.org/roo/d/indianapolis-room-available-500-month/6847519870.html,$500 Room available 500 a month utilities paid (Castleton),"I live in a newly renovated two bedroom apartment very nice. I'm w 30 
year old white male. I work a lot, especially during the summer. Just 
looking for someone to spilt the rent to save money for a house. Call 
317_2o9_fourtynine60",3/22/2019,10:09:00 AM,3/22/2019 10:09:00,500,apartment,male,30,katie_27,N,N,NA,NA,NA,,,6,6,NA
3/22/2019,10:49:00 PM,3/22/2019 19:49:00,https://indianapolis.craigslist.org/roo/d/indianapolis-looking-for-roommate-for/6839393393.html,$650 / 1400ft2 - - Looking for roommate for condo in Carmel (98th and Rangeline),"Looking for Male roommate to share condo in Carmel. Bedroom has private 
master bath, walk in closet, plenty of storage. Roommate must be 
dog-friendly. Bedroom is unfurnished. Condo has shared living area, full
 kitchen, and in unit laundry. Condo community is steps from the Monon 
Trail and has amenities such as a pool and gym. Roommate must pass 
background/credit check to be considered.    ",3/12/2019,6:52:00 AM,3/12/2019 6:52:00,650,condo,male,NA,katie_27,N,N,NA,NA,NA,,,6,3,NA
3/24/2019,10:07:00 PM,3/24/2019 19:07:00,https://indianapolis.craigslist.org/roo/d/indianapolis-rent-private-room-160-wk/6836070650.html,"$160 Rent private room $160/Wk-CABLE, Utilities, Internet ALL INCLUDED (Tacoma &  E Washington)","ALL INCLUSIVE 

10 minutes from downtown 

INDY GO 3 minutes walking distance

REQUIRED 1 wk deposit + 1 wk of rent ",3/7/2019,6:57:00 PM,3/7/2019 18:57:00,695,apartment,NA,NA,katie_27,N,N,NA,NA,NA,,,1,5,NA
3/24/2019,9:17:00 PM,3/24/2019 18:17:00,https://indianapolis.craigslist.org/roo/d/indianapolis-looking-for-roommate-to/6849492745.html,$380 / 678ft2 - Looking for a roommate to fill one extra master bedroom! (indianapolis),"Hello!*





Wonderful bedroom with luxurious bathroom available with very reasonable
 monthly cost just close to the shopping center and all great 
restaurants. Location is really beautiful, just best for living long 
time. 



If anyone interested in this rental opportunity just contact me by going
 to my rental profile address you see i have added on the pic and learn 
more! 



I'd be happy to answer your any questions!    ",3/24/2019,5:59:00 PM,3/24/2019 17:59:00,380,NA,female,NA,katie_43,N,N,NA,NA,NA,,,1,1,NA
3/24/2019,10:08:00 PM,3/24/2019 19:08:00,https://indianapolis.craigslist.org/roo/d/indianapolis-huge-2-spacious-room/6849431093.html,"$400 Huge 2 spacious room available for rent in (N Delaware St, Indianapolis, IN)","2 spacious room in a 3 bed 3 bath apartment is available right now to 
move in. Room is pretty spacious for 2 person. It will work perfect for 
someone who works in Portland. I am 24 years old, my name is Grey. I 
live a healthy lifestyle, workout and eat good. I do not smoke, do drugs
 nor drink. I understand if you do, but smoking and drugs are not 
allowed in the apartment drinking is fine if you keep it to yourself. 



I have a full time job and I am gone all day. I am probably the most 
understanding and the chill person you will ever meet.I am looking for 
someone who can pay their rent on time. Utilities are included.



*Appointment? Anytime message me here::(720) 507-5614

",3/24/2019,4:38:00 PM,3/24/2019 16:38:00,400,apartment,NA,24,katie_27,N,N,NA,NA,NA,,,1,1,NA
3/24/2019,9:23:00 PM,3/24/2019 18:23:00,https://indianapolis.craigslist.org/roo/d/indianapolis-seeking-for-roommate-in/6849417861.html,"$400 Seeking for a roommate in our Townhouse. (419 E Washington St, Indianapolis, IN)","Looking for a roommate to take the master suite in our Townhouse. The 
carpeted bedroom is 10x12', with a full-sized closet, and attached 6x10'
 full-bathroom. On the third floor, it has a a nice southward view of 
the street and neighborhood. The house is thuroughly furnished, and has a
 main floor with living, dining, kitchen, project space, and half bath. 



Some storage space may be available in the garage. Parking is on the 
street, but it's a safe neighborhood. Laundry is in the basement. The 
rent is $400/month and includes all utilities.



--Appointment? Leave me a text only here:(407) 504-7095



(Included your name & profession)
",3/24/2019,4:21:00 PM,3/24/2019 16:21:00,400,townhouse,NA,NA,katie_43,N,N,NA,NA,NA,,,1,1,NA
3/24/2019,9:25:00 PM,3/24/2019 18:25:00,https://indianapolis.craigslist.org/roo/d/indianapolis-2360ft2-2-br-in-fountain/6849416954.html,$650 2360ft2 - 2 BR in Fountain Square for rent. (Fountain Square / Indianapolis),"I have two bedrooms for rent in a recently renovated house located in 
vibrant Fountain Square. I am the owner, a male young professional, and I
 live in the third bedroom. I am looking for one or two responsible and 
tidy roommates to fill the open rooms, available at the end of April. No
 preference on the gender of either roommate.



The house is located a short walk to the heart of Fountain Square and 
Fletcher Place and a five minute drive to downtown or I-65. 2,360 square
 feet in total with 3 bedrooms and 2 bathrooms. The open bedrooms are 
each 130 square feet - 13x10 - and each have a closet. Features include 
an open floor plan, granite counter tops, all new stainless steel 
appliances, exposed cedar beams, cathedral/tray ceilings, two-story 
living room, a spiral staircase, fenced in front and back yards, a large
 back deck and front porch, contemporary lighting fixtures, and a two 
car garage.



The open bedrooms are not furnished as seen in the photos, but living spaces are.



Plenty of street parking available

1 garage spot available for an additional $15/month.

Utilities will be shared - gas, electric, recycling, Youtube TV, Verizon 5G Internet

Bedrooms include a closet not shown in the photos

Washer and dryer on the first floor

Dishwasher

Double Oven

Water softener installed

5 minute drive to Lilly, Salesforce, and others



Available end of April, but arrangements can be made for sooner in certain cases.



If you are interested, please contact me to set up a meeting and visit!    ",3/24/2019,4:20:00 PM,3/24/2019 16:20:00,650,house,male,NA,katie_43,Y,Y,3/24/2019,9:27:00 PM,3/24/2019 21:27:00,,,1,1,1
3/24/2019,10:09:00 PM,3/24/2019 19:09:00,https://indianapolis.craigslist.org/roo/d/indianapolis-just-need-better-roommate/6849299418.html,$320 / 640ft2 - Just need a better roommate for one nice private bedroom!,"Hello Roommates!..



Private bedroom, large bathroom, living area all furnished available in a
 clean, quiet, drama free townhouse. Includes a shared kitchen on main 
level, on site laundry.

If you would like to get my contact and detailed information about this 
place, you can just login to my rental page address you see i have added
 on the pic and feel free to text or call me



Plz!!!    ",3/24/2019,2:03:00 PM,3/24/2019 14:03:00,320,townhouse,NA,NA,katie_27,N,N,NA,NA,NA,,,1,1,NA
3/24/2019,10:10:00 PM,3/24/2019 19:10:00,https://indianapolis.craigslist.org/roo/d/master-suite-for-rent/6849356238.html,$550 Master suite for rent! (West),"I am a 48 year old professional female looking to rent out the 1st floor
 master bedroom of my home.  Includes a private bath, 2 closets and 
separate hallway that you can close off (and lock) from the rest of the 
house.  Also includes use of all common areas, including laundry, and 
huge, park-like yard. I'm looking for another professional, someone 
mature and responsible.  I would prefer a female.  Background check will
 be done.  I have several cats, so you must like or at least be able to 
tolerate living with pets! 



I'm on the West side, in a neighborhood just west of Michigan, between 
61st and 62nd.    Quiet neighborhood, not fancy, but safe and peaceful 
with lots of mature trees and wildlife.  Very central location....5-10 
minutes from Broad Ripple, 5-10 minutes from IMA and Butler, 10 minutes 
from Eagle Creek and 465, 20-25 minutes from downtown. 



I am a very laid back, artsy, earthy kind of person, and it would be 
great to find someone similar, although not essential.  Please, no kids,
 no pets, no smoking, no drugs, no drama.  Rent is $500/month 
unfurnished or $550 furnished and includes all utilities and wi-fi and 
cable in your bedroom.  I require a $250 deposit as well.  Please reply 
and put ""Room for Rent"" in subject line if interested.    ",3/24/2019,3:07:00 PM,3/24/2019 15:07:00,550,house,female,48,katie_27,Y,Y,3/25/2019,7:52:00 PM,3/25/2019 19:52:00,,,1,1,2
3/24/2019,10:10:00 PM,3/24/2019 19:10:00,https://indianapolis.craigslist.org/roo/d/indianapolis-room-for-rent/6849326981.html,$600 / 450ft2 - Room for Rent (Indianapolis),"Downstairs room and full bathroom for rent. The room used to be my 
living room and dining room but I walled it off and put up french doors 
because I never used it. There is a full bathroom attached and it walks 
out to the kitchen and the entryway. The pictures that are attached are 
of the actual room for rent. I am looking for someone who is as quiet as
 I am, preferable another college student. $600 a month includes all 
utilities, internet, and a security system. I work a full time job 
downtown and go to college in the evenings so I am in and out a lot. I 
have two dogs and three cats and would consider reduced rent to someone 
who could look after the dogs during the day.",3/24/2019,2:34:00 PM,3/24/2019 14:34:00,600,house,NA,NA,katie_27,Y,Y,3/24/2019,10:14:00 PM,3/24/2019 22:14:00,,,1,1,1
3/24/2019,9:34:00 PM,3/24/2019 18:34:00,https://indianapolis.craigslist.org/roo/d/indianapolis-small-room-for-rent-female/6849317772.html,$400 Small room for rent female only (Castleton),"Small for for rent for female. $400 a month includes everything. Cable, wifi, all utilities, washer and dryer in unit. No pets please. If interested message me. Thanks.",3/24/2019,2:23:00 PM,3/24/2019 14:23:00,400,apartment,NA,NA,katie_43,Y,Y,3/24/2019,10:14:00 PM,3/24/2019 22:14:00,male,,1,1,1
3/24/2019,10:14:00 PM,3/24/2019 19:14:00,https://indianapolis.craigslist.org/roo/d/indianapolis-broad-ripple-monon-3-story/6849296604.html,"$700 / 1600ft2 - Broad Ripple/Monon 3 Story Condo (66th & College Ave)
","Room for Rent starting Mid April in three story condominium in Broad 
Ripple off of Monon Trail.  In unit clothes washer and dryer.  Walking 
distance to many shops and local eateries.   



Pictures of room with walk in closet Will be made available.  



You would be living with my girlfriend and myself who are working professionals.    ",3/24/2019,2:00:00 PM,3/24/2019 14:00:00,700,condo,male,NA,katie_27,Y,Y,3/24/2019,11:11:00 PM,3/24/2019 23:11:00,presumed male,,1,1,1
3/24/2019,9:38:00 PM,3/24/2019 18:38:00,https://indianapolis.craigslist.org/roo/d/indianapolis-sublease-next-to-iupui/6849205625.html,$939 / 860ft2 - Sublease next to IUPUI Apartment (Indiana Ave & University Blvd),"Sublease 1 bedroom of a 2 bedroom apartment next to IUPUI. Lease good 
till August.  Walking distance to everything. Lots of restaurants. 
Apartment complex has many added features. Workout area, swimming pool, 
computer station, free coffee, next to IUPUI, etc. 

2 bedroom Apartment is large with shared kitchen, living room, great 
porch, washer & dryer.  Bedroom is large with full bath and large 
walk-in closet.  Furniture available to rent or bring your own.  
Included cable and Internet, water, washer & dryer, Shared electric.
 

Overall $938.95 total rent 

Rent: $910

Green Fee $10

Rent Plus $6.95

Renters insurance $12 



Available May 1 ",3/24/2019,12:15:00 PM,3/24/2019 12:15:00,939,apartment,NA,NA,katie_43,N,N,NA,NA,NA,,,1,1,NA
3/24/2019,10:15:00 PM,3/24/2019 19:15:00,https://indianapolis.craigslist.org/roo/d/indianapolis-looking-for-quiet-roomie/6848856544.html,$500 Looking for a quiet roomie (Eagle creek),Laid back quiet female... Looking for a quiet drama free roomie. No pets,3/23/2019,7:11:00 PM,3/23/2019 19:11:00,500,apartment,female,NA,katie_27,Y,Y,3/27/2019,7:00:00 PM,3/27/2019 19:00:00,,,1,7,4
3/24/2019,10:16:00 PM,3/24/2019 19:16:00,https://indianapolis.craigslist.org/roo/d/indianapolis-downtown-iupui-campus/6848798852.html,"$598 / 1200ft2 - downtown-IUPUI campus furnished , utilities, WiFi  incl $598 (1423 E Lynn Dr,Indianapolis,IN)","good day ,

We are looking for two roommate is to share this house with us  full 
kitchen including dishwasher and separate laundry room has  wall fire 
place and all cooking Ware and utensils including too   (all utilities, 
WiFi and all furnished  because new hardwood  floor please  wear 
slippers inside the house.so we can keep house clean.quite time between 
11 pm and 7 am. Please contact property manager David  at  show contact info
. If you like check out our place

It is very. Convenient location walking distance to all the restaurant 
like Starbucks Chipotle, pizza hut , panda express family Dollar, 
Lincoln pancakes house, city BBQ and crown liquid store. Even Subway 
sandwich , Hardee ,papa John in 5 minutes walking distance and we are on
 busline to downtown convention center

We have Protection one security system and new concrete parking lot and with security light

We have one private room with private bathroom is $598. Another private room share big bathroom is $585. All furnished

House rules: no smoking /no party and no pet . Thanks :)",3/23/2019,5:48:00 PM,3/23/2019 17:48:00,598,house,NA,NA,katie_27,Y,Y,3/24/2019,11:16:00 PM,3/24/2019 23:16:00,presumed male,,1,7,1
3/24/2019,10:17:00 PM,3/24/2019 19:17:00,https://indianapolis.craigslist.org/roo/d/indianapolis-roommate-opening/6848556473.html,$590 / 1750ft2 - Roommate Opening,"Seeking roommate in a furnished house. Now available. 

Message with your name and contact information if you are interested. 

*Non smokers only. 

Students and working professionals.

I will delete this ad when this room is rented.



Private bedroom area on first floor. You furnish your room. 

Large closet. 

Common areas are furnished and shared. 

Secure Nora suburb. Close to parks, gyms, and shopping . Flexible lease. 

In a great area. 

Quiet hours observed as a courtesy to roommates schedules. 

Laid back atmosphere. Privacy. 

Off street parking. Large yard. Private deck. Attached 2 car garage.

$590 a month. 

Utilities and internet are included. 



No pets please. 

No alcohol or drug abusers.

Background check.",3/23/2019,1:23:00 PM,3/23/2019 13:23:00,590,house,NA,NA,katie_27,Y,Y,3/25/2019,10:57:00 AM,3/25/2019 10:57:00,,,1,7,2
3/24/2019,9:56:00 PM,3/24/2019 18:56:00,https://indianapolis.craigslist.org/roo/d/indianapolis-roommate-needed-in/6848337723.html,$700 / 1100ft2 - Roommate needed in Fountain Square (North Square),"Extra room available in a cute 2bdrm, 1 ba home in amazing Fountain 
Square / North Square. Bedroom is furnished; bathroom is obviously 
shared. Utilities included. Street parking available. There are two cats
 in the home; no additional pets, please. 



Home is within minutes of downtown, and steps from all the best 
restaurants and hot spots in Fountain Square. The block is quiet and 
safe, with excellent neighbors. 



$700 / month rent includes utilities (water, electricity, gas, and internet). Security deposit is $700.    ",3/23/2019,9:37:00 AM,3/23/2019 9:37:00,700,house,NA,NA,katie_43,Y,Y,3/25/2019,3:42:00 PM,3/25/2019 15:42:00,female,,1,7,2
3/24/2019,9:58:00 PM,3/24/2019 18:58:00,https://indianapolis.craigslist.org/roo/d/indianapolis-indy-downtown-lockerbie-3/6848329607.html,"$400 / 1800ft2 - Indy downtown- Lockerbie  3 bdroom house  room to share $400 (235 Fulton Street. Indianapolis,IN)","Downtown indnapolis. ( Lockerbie ) 3 story  new remodeling house 3 bd room 1/2 bath. Upscale house looking for one roommate

House has fireplace hardwood floors. New paint and one big bedroom. Abd all applicance plus washer and dryer

Walking distance to Mass Ave abd old Marsh supermarket. Only 7 minutes go to I-65 only one minutes

House has one old dog very friendly.. rent $400 share utilities included  WiFi 

Will be available Marsh 23 2019    ",3/23/2019,9:24:00 AM,3/23/2019 9:24:00,400,house,NA,NA,katie_43,Y,Y,3/25/2019,11:00:00 AM,3/25/2019 11:00:00,,,1,7,2
3/24/2019,10:18:00 PM,3/24/2019 19:18:00,https://indianapolis.craigslist.org/roo/d/carmel-roomie-wanted/6848314382.html,$700 Roomie wanted! (Carmel or Zionsville),"Looking to move this summer/ soon but needing a room mate. I have an 
idea of the place I want to move to but I am open to options. Trying to 
keep the shared rent under 700. I have living room and kitchen furniture
 and possibly a bed that would be available for use. I also have a 
puppy. 

No smokers please and preferably female in their 20s.    ",3/23/2019,8:58:00 AM,3/23/2019 8:58:00,700,apartment,NA,NA,katie_27,Y,Y,3/25/2019,12:10:00 PM,3/25/2019 12:10:00,,,1,7,2
3/24/2019,10:18:00 PM,3/24/2019 22:18:00,https://indianapolis.craigslist.org/roo/d/indianapolis-room-and-bath-in-condo/6848262099.html,"$400 / 2400ft2 - Room and Bath in Condo Townhouse for Rent. (Keystone/Kessler, Broad Ripple)","Working student or professional tenant preferred. Non-smokers only. Rent
 will be $400/month for example all utilities (WiFi however no cable). 
Would ask for a $200 deposit. Nice-sized front bedroom (12' x 12') for 
lease at charming bungalow. Shared kitchen and bathroom, both 
modernized; lots of storage area in basement. House has front porch and 
rear deck, hardwood flooring. Quiet residential area suitable to the 
Glendale mall/Target, Keystone Ave and Broad Ripple Aves. The room is 
completely furnished but may be altered. I've got two favorable pets - a
 little cat and dog. No other pets . Available after April two - Leasing
 duration flexible.



*If this sounds like a good match please message here:  (323) 452-2361",3/23/2019,5:54:00 AM,3/23/2019 5:54:00,400,townhouse,NA,NA,katie_27,N,N,NA,NA,NA,,,1,7,NA
3/25/2019,1:24:00 AM,3/25/2019 22:24:00,https://indianapolis.craigslist.org/roo/d/nice-room-for-rent-near-castleton/6850467392.html,Nice room for rent near Castleton,"Nice room for rent with bath in house near Castleton. Includes free wifi and w/d use. Clean, responsible, employed. $500 month + $200 deposit",3/16/2019,1:24:00 AM,3/16/2019 1:24:00,500,house,NA,NA,katie_27,Y,Y,3/26/2019,10:25:00 PM,3/26/2019 22:25:00,,,2,7,3
3/25/2019,1:51:00 AM,3/25/2019 22:51:00,https://indianapolis.craigslist.org/roo/d/greenwood-roommate-shared-house-asap/6842632018.html,Roommate/shared house ASAP,"Looking for someone ready to move ASAP! I'm a 26 year old white male. Very easy going, laid back and drama free. Very clean and organized. I also have 1 small dog 🐶 she's just an older big baby. I have a 3 bedroom house right off of highway 37 on the southwest corner of greenwood, and looking for a roommate to help share the cost of living with. Bedrooms are not furnished, but rest of the house is. Hoping to find another male somewhere close to age anywhere from 18-about 30. But I'm flexible. Will also consider a female around the same age as well. I'm happy to share whatever I have with you, but you need to pitch in as well, and not just eat or drink whatever I have without providing also. I have Direct TV cable, and will pay for that, has hookup in bedrooms, living room, and basement. I don't have internet, but will consider getting it if you desire and can throw in on it. Have all appliances, and washer and dryer. I will also supply laundry detergent, fabric softener, and dryer sheets. Shared bathroom, but I'm very clean and keep everything clean always! Or you could have the entire basement to yourself. Has cable hookup, and shower in it, but no sink or toilet. It's not a brand new or perfect house, has its flaws, but very livable and cozy. I'm slowly working on improving it, and if you're willing to help then that's even better! Mainly just needs painted inside in every room. Which I almost have done now. I'm looking for $600 a month. That sounds like a lot, but it's really not considering it's a shared house, not just limited to one room, and that is everything included; rent, all utilities, power, heat, ac, cable, etc... I can try to work with you though, so just get with me and we can figure something out. Message or text for any other details! Please give info about yourself when you reply, like age, whether you have a job, vehicle, and can split cost, etc, and please send a picture so I know you're real and serious! Thanks 317-Five88-2one3two",3/16/2019,1:24:00 AM,3/16/2019 1:24:00,600,house,male,26,katie_27,N,N,NA,NA,NA,,,2,7,NA
3/25/2019,1:51:00 AM,3/25/2019 22:51:00,https://indianapolis.craigslist.org/roo/d/whitestown-private-suite-in-quiet-home/6850329195.html,"Private Suite in Quiet Home, Great Location","Gay male leasing out spare full guest bedroom w/ private full bath in a cozy 2900 sq ft home. Gourmet kitchen and plenty of storage. Luxuriaties include private back yard with pool access near the community pool. Home is also close to freeway entrance in quiet suburban neighborhood - 30 minutes from virtually anywhere within the Metro Indianapolis area. Authentic 4 star restaurants in nearby neighborhoods. Guest Bedroom has a private bath with 46"" TV. Bedroom can be left furnished upon request. Off street parking available. This price has been reduced. $549/mo with 1/3 of utilities expected. Prospects in potential roommate; : Be ok with 2 cats (very clean and ultra friendly) : Reliable source of verifiable monthly income  : Backround check preferred : Security Deposit and 1st Mo. Rent",3/25/2019,5:47:00 PM,3/25/2019 17:47:00,549,house,male,NA,katie_27,Y,Y,3/26/2019,10:09:00 PM,3/26/2019 22:09:00,,,2,2,3
3/25/2019,1:55:00 AM,3/25/2019 22:55:00,https://indianapolis.craigslist.org/roo/d/indianapolis-furnished-room-utilities/6850247475.html,"Furnished room, utilities/internet paid","Hi, Two rooms are available in this half a double near Woodruff Place and Angie's List, and 26 blocks from IUPUI. The closest west bound bus route and bike lane, Michigan Street, is 1/2 block away. The closest east bound bus route and bicycle lane, New York Street, is 1 1/2 blocks away. Respond by letting me know why the interested individual would make an excellent tenant and roommate. The bedroom door locks. Furnishings include a bed, table, and chair. A dresser is optional. Each occupant is on a separate rental agreement. The common rooms are a living room, kitchen, laundry room, bathroom, half bathroom, and a utility room with a washer and dryer for use by occupants. Renter's insurance is included in the price. Utilities are paid by the landlord, including Internet access. If interested, ask about the option to use the Ethernet. Parking is available on the street as well as in back. Pets are generally not allowed (example of a possible exception is for fish kept in the half bathroom in a small container). Smoking and vaping of any sort are not allowed. Selected occupant must be neat, pass the screening process (including financial, and criminal and civil courts), be responsible, quiet and get along with others. The landlord, a futurist / environmentalist lives next door, and a techie/student, and factory worker live there. Gardeners, neighborly people, bicyclists, commuters by bus, people who like to live near Downtown, nonsmokers, and ecological minded people might especially appreciate this location. By the way, I know of landlords who rent bedrooms, studios, apartments and houses. Currently (01/27/2019) I know of bedrooms and a one bedroom apartment ($650) for rent. Prices for bedrooms are $350 to $400. Again, respond by letting me know why the interested individual would make an excellent tenant and roommate. ___________________________________________________________________________ Angies List Indiana University Purdue University Dental School Downtown Down Town",3/25/2019,4:17:00 PM,3/25/2019 16:17:00,365,house,NA,NA,katie_43,Y,Y,3/26/2019,4:02:00 PM,3/26/2019 16:02:00,presumed male,,2,2,3
3/25/2019,1:27:00 AM,3/25/2019 22:27:00,https://indianapolis.craigslist.org/roo/d/indianapolis-room-offered-furnished/6850167809.html,room offered furnished/unfurnished,"private room offered (it can be furnished)with private entrance 2 windows, shared kitchen and shared full bath, laundry onsite, close to shopping, bus lines, safe area nice families all around, extra storage in basement or garage, parking off street or backyard. all utilities included electric water gas and internet, other room occupied, guy very respectful' no smoke no drug no alcohol no drama no animals rent is 6 months minimum lease then month to month 390+200 deposit, area calm and safe, perfect for student, immigrant, or simply people who like to be with a roommate, this room will go fast ask questions i will answer, best tenant must have a job and a clean background check,",3/25/2019,2:57:00 PM,3/25/2019 14:57:00,390,house,NA,NA,katie_27,Y,Y,3/26/2019,12:22:00 PM,3/26/2019 12:22:00,,,2,2,3
